VALUE,NVC_NAME,LFRDB,LFLIFEFORM,NVC_CLASS,NVC_SUBCLASS,NVC_FORMATION,NVC_DIVISION,CLASS,SUBCLASS,FORMATION,DIVISION_CODE,DIVISION,MACROGROUP_CODE,MACROGROUP,Group_Code,GROUP,R,G,B,RED,GREEN,BLUE
6669,Chihuahuan Semi-Desert Lowland Shrub Steppe,6269,Shrub,3,3.A,3.A.2,3.A.2.Na,3 Desert & Semi-Desert,3.A Warm Desert & Semi-Desert Woodland,3.A.2 Warm Desert & Semi-Desert Scrub & Grassland,D039,3.A.2.Na North American Warm Desert Scrub & Grassland,M087,Chihuahuan Semi-Desert Grassland,G489,Chihuahuan Semi-Desert Lowland Grassland,255,204,51,1,0.8,0.2
6670,Chihuahuan Sandy Plains Semi-Desert Sparse Vegetation,6268,Sparse,3,3.A,3.A.2,3.A.2.Na,3 Desert & Semi-Desert,3.A Warm Desert & Semi-Desert Woodland,3.A.2 Warm Desert & Semi-Desert Scrub & Grassland,D039,3.A.2.Na North American Warm Desert Scrub & Grassland,M087,Chihuahuan Semi-Desert Grassland,G491,Chihuahuan Sandy Plains Semi-Desert Grassland,255,233,135,1,0.913725,0.529412
6672,Mojave-Sonoran Bajada & Valley Desert Sparse Vegetation,6272,Sparse,3,3.A,3.A.2,3.A.2.Na,3 Desert & Semi-Desert,3.A Warm Desert & Semi-Desert Woodland,3.A.2 Warm Desert & Semi-Desert Scrub & Grassland,D039,3.A.2.Na North American Warm Desert Scrub & Grassland,M088,Mojave-Sonoran Semi-Desert Scrub,G295,Mojave-Sonoran Bajada & Valley Desert Scrub,161,134,96,0.631373,0.52549,0.376471
6673,North American Warm Semi-Desert Shrub Dunes & Sand Flats,6273,Shrub,3,3.A,3.A.2,3.A.2.Na,3 Desert & Semi-Desert,3.A Warm Desert & Semi-Desert Woodland,3.A.2 Warm Desert & Semi-Desert Scrub & Grassland,D039,3.A.2.Na North American Warm Desert Scrub & Grassland,M088,Mojave-Sonoran Semi-Desert Scrub,G675,North American Warm Semi-Desert Dunes & Sand Flats,100,100,100,0.392157,0.392157,0.392157
6674,North American Warm Semi-Desert Dunes & Sand Flats,6273,Sparse,3,3.A,3.A.2,3.A.2.Na,3 Desert & Semi-Desert,3.A Warm Desert & Semi-Desert Woodland,3.A.2 Warm Desert & Semi-Desert Scrub & Grassland,D039,3.A.2.Na North American Warm Desert Scrub & Grassland,M088,Mojave-Sonoran Semi-Desert Scrub,G675,North American Warm Semi-Desert Dunes & Sand Flats,100,100,100,0.392157,0.392157,0.392157
6676,Warm Semi-Desert Herb Dry Wash & Colluvial Slope,6276,Herb,3,3.A,3.A.2,3.A.2.Na,3 Desert & Semi-Desert,3.A Warm Desert & Semi-Desert Woodland,3.A.2 Warm Desert & Semi-Desert Scrub & Grassland,D039,3.A.2.Na North American Warm Desert Scrub & Grassland,M092,North American Warm-Desert Xeric-Riparian Scrub,G541,Warm Semi-Desert Shrub & Herb Dry Wash & Colluvial Slope,81,180,141,0.317647,0.705882,0.552941
6677,Warm Semi-Desert Dry Wash & Colluvial Slope,6276,Sparse,3,3.A,3.A.2,3.A.2.Na,3 Desert & Semi-Desert,3.A Warm Desert & Semi-Desert Woodland,3.A.2 Warm Desert & Semi-Desert Scrub & Grassland,D039,3.A.2.Na North American Warm Desert Scrub & Grassland,M092,North American Warm-Desert Xeric-Riparian Scrub,G541,Warm Semi-Desert Shrub & Herb Dry Wash & Colluvial Slope,81,180,141,0.317647,0.705882,0.552941
6678,Tamaulipan Dry Mesquite & Thornscrub Woodland,6278,Tree,3,3.A,3.A.2,3.A.2.Na,3 Desert & Semi-Desert,3.A Warm Desert & Semi-Desert Woodland,3.A.2 Warm Desert & Semi-Desert Scrub & Grassland,D039,3.A.2.Na North American Warm Desert Scrub & Grassland,M130,Tamaulipan Scrub & Grassland,G099,Tamaulipan Dry Mesquite & Thornscrub,82,52,34,0.321569,0.203922,0.133333
6683,Intermountain Dune Grassland,6283,Herb,3,3.B,3.B.1,3.B.1.Ne,3 Desert & Semi-Desert,3.B Cool Semi-Desert Scrub & Grassland,3.B.1 Cool Semi-Desert Scrub & Grassland,D040,3.B.1.Ne Western North American Cool Semi-Desert Scrub & Grassland,M171,Great Basin & Intermountain Dry Shrubland & Grassland,G775,Intermountain Sparsely Vegetated Dune Scrub & Grassland,100,100,100,0.392157,0.392157,0.392157
6684,Intermountain Sparsely Vegetated Dune,6283,Sparse,3,3.B,3.B.1,3.B.1.Ne,3 Desert & Semi-Desert,3.B Cool Semi-Desert Scrub & Grassland,3.B.1 Cool Semi-Desert Scrub & Grassland,D040,3.B.1.Ne Western North American Cool Semi-Desert Scrub & Grassland,M171,Great Basin & Intermountain Dry Shrubland & Grassland,G775,Intermountain Sparsely Vegetated Dune Scrub & Grassland,100,100,100,0.392157,0.392157,0.392157
6689,Cool Semi-Desert Wash-Arroyo,6289,Sparse,3,3.B,3.B.1,3.B.1.Ne,3 Desert & Semi-Desert,3.B Cool Semi-Desert Scrub & Grassland,3.B.1 Cool Semi-Desert Scrub & Grassland,D040,3.B.1.Ne Western North American Cool Semi-Desert Scrub & Grassland,M095,Great Basin & Intermountain Xeric-Riparian Scrub,G559,Great Basin-Intermountain Shrub & Herb Wash-Arroyo,100,100,100,0.392157,0.392157,0.392157
6692,Eastern Alpine Dwarf-Herb Vegetation,6292,Herb,4,4.B,4.B.1,4.B.1.Na,4 Polar & High Montane Scrub Grassland & Barrens,4.B Temperate to Polar Alpine & Tundra Vegetation,4.B.1 Temperate & Boreal Alpine Dwarf-Shrub & Grassland,D042,4.B.1.Na Eastern North American Alpine Dwarf-Shrub & Grassland,M131,Eastern North American Alpine Shrub & Grassland,G104,Eastern Alpine Dwarf-Shrub-Herb Vegetation,255,211,119,1,0.827451,0.466667
6694,Rocky Mountain & Sierran Alpine Turf & Fell-Field Sparse Vegetation,6294,Sparse,4,4.B,4.B.1,4.B.1.Nb,4 Polar & High Montane Scrub Grassland & Barrens,4.B Temperate to Polar Alpine & Tundra Vegetation,4.B.1 Temperate & Boreal Alpine Dwarf-Shrub & Grassland,D043,4.B.1.Nb Western North American Alpine Dwarf-Shrub & Grassland,M099,Rocky Mountain & Sierran Alpine Scrub Forb Meadow & Grassland,G314,Rocky Mountain & Sierran Alpine Turf & Fell-Field,255,211,119,1,0.827451,0.466667
6724,Southeastern Great Plains Floodplain Shrubland,6324,Shrub,1,1.B,1.B.3,1.B.3.Nb,1 Forest & Woodland,1.B Temperate & Boreal Forest & Woodland,1.B.3 Temperate Flooded & Swamp Forest,D062,1.B.3.Nb Southeastern North American Flooded & Swamp Forest,M154,Southern Great Plains Floodplain & Riparian Forest & Woodland,G784,Southeastern Great Plains Floodplain Forest,145,255,115,0.568627,1,0.45098
6725,Laurentian-Acadian Acidic Grassland,6325,Herb,2,2.B,2.B.2,2.B.2.Nc,2 Shrub & Herb Vegetation,2.B Temperate & Boreal Grassland & Shrubland,2.B.2 Temperate Grassland,D024,2.B.2.Nc Eastern North American Grassland & Shrubland,M505,Laurentian-Acadian Acidic Rocky Scrub & Grassland,G788,Laurentian-Acadian Acidic Scrub & Grassland,255,148,71,1,0.580392,0.278431
6726,Southeastern Great Plains Floodplain Herbaceous,6324,Herb,1,1.B,1.B.3,1.B.3.Nb,1 Forest & Woodland,1.B Temperate & Boreal Forest & Woodland,1.B.3 Temperate Flooded & Swamp Forest,D062,1.B.3.Nb Southeastern North American Flooded & Swamp Forest,M154,Southern Great Plains Floodplain & Riparian Forest & Woodland,G784,Southeastern Great Plains Floodplain Forest,145,255,115,0.568627,1,0.45098
6727,North-Central Appalachian Acidic Grassland,6326,Herb,2,2.B,2.B.2,2.B.2.Nc,2 Shrub & Herb Vegetation,2.B Temperate & Boreal Grassland & Shrubland,2.B.2 Temperate Grassland,D024,2.B.2.Nc Eastern North American Grassland & Shrubland,M506,Appalachian Rocky Felsic & Mafic Scrub & Grassland,G789,North-Central Appalachian Acidic Scrub & Grassland,82,52,34,0.321569,0.203922,0.133333
6731,Interior West Riparian Shrubland,6331,Shrub,1,1.B,1.B.3,1.B.3.Nd,1 Forest & Woodland,1.B Temperate & Boreal Forest & Woodland,1.B.3 Temperate Flooded & Swamp Forest,D013,1.B.3.Nd Interior Lowland West Flooded & Swamp Forest,M036,Southwest Riparian Forest,G797,Warm Southwest Riparian Forest & Woodland,81,180,141,0.317647,0.705882,0.552941
6737,Caribbean Flooded Shrub,6337,Shrub,1,1.A,1.A.4,1.A.4.Ed,1 Forest & Woodland,1.A Tropical Forest & Woodland,1.A.4 Tropical Flooded & Swamp Forest,D093,1.A.4.Ed Caribbean & Central American Flooded & Swamp Forest,M618,Caribbean Floodplain Forest,G459,Caribbean Flooded Forest,156,128,92,0.611765,0.501961,0.360784
6741,Caribbean Montane Cloud Scrub,6341,Shrub,1,1.A,1.A.3,1.A.3.Eg,1 Forest & Woodland,1.A Tropical Forest & Woodland,1.A.3 Tropical Montane Humid Forest,D228,1.A.3.Eg Caribbeo-Mesoamerican Montane Humid Forest,M598,Caribbean Montane Humid Forest,G451,Caribbean Montane Cloud Forest & Scrub,174,245,224,0.682353,0.960784,0.878431
6742,Caribbean Montane Rocky Riverine Scrub,6342,Shrub,1,1.A,1.A.3,1.A.3.Eg,1 Forest & Woodland,1.A Tropical Forest & Woodland,1.A.3 Tropical Montane Humid Forest,D228,1.A.3.Eg Caribbeo-Mesoamerican Montane Humid Forest,M598,Caribbean Montane Humid Forest,G449,Caribbean Montane Rocky Riverine Scrub,156,128,92,0.611765,0.501961,0.360784
6753,Hawaiian Coastal Strand,6353,Sparse,2,2.A,2.A.3,2.A.3.Ob,2 Shrub & Herb Vegetation,"2.A Tropical Grassland, Savanna & Shrubland",2.A.3 Tropical Scrub & Herb Coastal Vegetation,D078,2.A.3.Ob Polynesian Scrub & Herb Coastal Vegetation,M231,Hawaiian Scrub & Herb Coastal Vegetation,G421,Hawaiian Dry Scrub & Herb Coastal Strand,100,100,100,0.392157,0.392157,0.392157
6760,Hawaiian Lowland Dry Grassland,6360,Herb,2,2.A,2.A.1,2.A.1.Ol,2 Shrub & Herb Vegetation,"2.A Tropical Grassland, Savanna & Shrubland","2.A.1 Tropical Lowland Grassland, Savanna & Shrubland",D074,"2.A.1.Ol Polynesian Lowland Shrubland, Grassland & Savanna",M217,"Hawaiian Lowland Shrubland, Grassland & Savanna",G410,Hawaiian Lowland Dry Shrubland & Grassland,251,121,54,0.984314,0.47451,0.211765
6761,Hawaiian Lowland Mesic-Wet Grassland,6361,Herb,2,2.A,2.A.1,2.A.1.Ol,2 Shrub & Herb Vegetation,"2.A Tropical Grassland, Savanna & Shrubland","2.A.1 Tropical Lowland Grassland, Savanna & Shrubland",D074,"2.A.1.Ol Polynesian Lowland Shrubland, Grassland & Savanna",M217,"Hawaiian Lowland Shrubland, Grassland & Savanna",G411,Hawaiian Lowland Mesic-Wet Shrubland & Grassland,255,114,48,1,0.447059,0.188235
6765,Hawaiian Montane-Subalpine Dry Grassland,6365,Herb,2,2.A,2.A.2,2.A.2.Oh,2 Shrub & Herb Vegetation,"2.A Tropical Grassland, Savanna & Shrubland",2.A.2 Tropical Montane Grassland & Shrubland,D076,"2.A.2.Oh Polynesian Montane Shrubland, Grassland & Savanna",M224,"Hawaiian Montane Shrubland, Grassland & Savanna",G416,Hawaiian Montane-Subalpine Dry Shrubland & Grassland,251,121,54,0.984314,0.47451,0.211765
6767,Hawaiian Montane-Subalpine Mesic-Wet Grassland,6367,Herb,2,2.A,2.A.2,2.A.2.Oh,2 Shrub & Herb Vegetation,"2.A Tropical Grassland, Savanna & Shrubland",2.A.2 Tropical Montane Grassland & Shrubland,D076,"2.A.2.Oh Polynesian Montane Shrubland, Grassland & Savanna",M224,"Hawaiian Montane Shrubland, Grassland & Savanna",G417,Hawaiian Montane-Subalpine Mesic-Wet Shrubland & Grassland,255,114,48,1,0.447059,0.188235
6769,Hawaiian Riparian & Floodplain Scrub,6369,Shrub,1,1.A,1.A.4,1.A.4.Ob,1 Forest & Woodland,1.A Tropical Forest & Woodland,1.A.4 Tropical Flooded & Swamp Forest,D003,1.A.4.Ob Polynesian Flooded & Swamp Forest,M201,Hawaiian Flooded & Swamp Forest,G398,Hawaiian Riparian & Floodplain Forest & Shrubland,255,105,46,1,0.411765,0.180392
6827,North-Central Appalachian Acidic Woodland,6326,Tree,2,2.B,2.B.2,2.B.2.Nc,2 Shrub & Herb Vegetation,2.B Temperate & Boreal Grassland & Shrubland,2.B.2 Temperate Grassland,D024,2.B.2.Nc Eastern North American Grassland & Shrubland,M506,Appalachian Rocky Felsic & Mafic Scrub & Grassland,G789,North-Central Appalachian Acidic Scrub & Grassland,82,52,34,0.321569,0.203922,0.133333
7191,Recently Logged-Herb and Grass Cover,7191,Herb,10,10.A,10.A,10.A,Recently Disturbed or Modified,Recently Disturbed or Modified,Recently Disturbed or Modified,10.A,Recently Disturbed or Modified,10.A,Recently Disturbed or Modified,10.A,Recently Disturbed or Modified,255,68,25,1,0.266667,0.098039
7192,Recently Logged-Shrub Cover,7192,Shrub,10,10.A,10.A,10.A,Recently Disturbed or Modified,Recently Disturbed or Modified,Recently Disturbed or Modified,10.A,Recently Disturbed or Modified,10.A,Recently Disturbed or Modified,10.A,Recently Disturbed or Modified,255,68,25,1,0.266667,0.098039
7193,Recently Logged-Tree Cover,7193,Tree,10,10.A,10.A,10.A,Recently Disturbed or Modified,Recently Disturbed or Modified,Recently Disturbed or Modified,10.A,Recently Disturbed or Modified,10.A,Recently Disturbed or Modified,10.A,Recently Disturbed or Modified,255,68,25,1,0.266667,0.098039
7195,Recently Burned-Herb and Grass Cover,7195,Herb,10,10.A,10.A,10.A,Recently Disturbed or Modified,Recently Disturbed or Modified,Recently Disturbed or Modified,10.A,Recently Disturbed or Modified,10.A,Recently Disturbed or Modified,10.A,Recently Disturbed or Modified,255,59,20,1,0.231373,0.078431
7196,Recently Burned-Shrub Cover,7196,Shrub,10,10.A,10.A,10.A,Recently Disturbed or Modified,Recently Disturbed or Modified,Recently Disturbed or Modified,10.A,Recently Disturbed or Modified,10.A,Recently Disturbed or Modified,10.A,Recently Disturbed or Modified,255,59,20,1,0.231373,0.078431
7197,Recently Burned-Tree Cover,7197,Tree,10,10.A,10.A,10.A,Recently Disturbed or Modified,Recently Disturbed or Modified,Recently Disturbed or Modified,10.A,Recently Disturbed or Modified,10.A,Recently Disturbed or Modified,10.A,Recently Disturbed or Modified,255,59,20,1,0.231373,0.078431
7198,Recently Disturbed Other-Herb and Grass Cover,7198,Herb,10,10.A,10.A,10.A,Recently Disturbed or Modified,Recently Disturbed or Modified,Recently Disturbed or Modified,10.A,Recently Disturbed or Modified,10.A,Recently Disturbed or Modified,10.A,Recently Disturbed or Modified,255,68,25,1,0.266667,0.098039
7199,Recently Disturbed Other-Shrub Cover,7199,Shrub,10,10.A,10.A,10.A,Recently Disturbed or Modified,Recently Disturbed or Modified,Recently Disturbed or Modified,10.A,Recently Disturbed or Modified,10.A,Recently Disturbed or Modified,10.A,Recently Disturbed or Modified,255,68,25,1,0.266667,0.098039
7200,Recently Disturbed Other-Tree Cover,7200,Tree,10,10.A,10.A,10.A,Recently Disturbed or Modified,Recently Disturbed or Modified,Recently Disturbed or Modified,10.A,Recently Disturbed or Modified,10.A,Recently Disturbed or Modified,10.A,Recently Disturbed or Modified,255,68,25,1,0.266667,0.098039
7292,Open Water,7292,Water,11,11.A,11.A,11.A,Open Water,Open Water,Open Water,11.A,Open Water,11.A,Open Water,11.A,Open Water,0,0,255,0,0,1
7295,Quarries-Strip Mines-Gravel Pits-Energy Development,7295,Barren,8,8.B,8.B,8.B,Quarries-Strip Mines-Gravel Pits-Energy Development,Quarries-Strip Mines-Gravel Pits-Energy Development,Quarries-Strip Mines-Gravel Pits-Energy Development,8.B,Quarries-Strip Mines-Gravel Pits-Energy Development,8.B,Quarries-Strip Mines-Gravel Pits-Energy Development,8.B,Quarries-Strip Mines-Gravel Pits-Energy Development,230,232,250,0.901961,0.909804,0.980392
7296,Developed-Low Intensity,7296,Developed,8,8.A,8.A,8.A,Developed-Low Intensity,Developed-Low Intensity,Developed-Low Intensity,8.A,Developed-Low Intensity,8.A,Developed-Low Intensity,8.A,Developed-Low Intensity,255,122,143,1,0.478431,0.560784
7297,Developed-Medium Intensity,7297,Developed,8,8.A,8.A,8.A,Developed-Medium Intensity,Developed-Medium Intensity,Developed-Medium Intensity,8.A,Developed-Medium Intensity,8.A,Developed-Medium Intensity,8.A,Developed-Medium Intensity,253,44,79,0.992157,0.172549,0.309804
7298,Developed-High Intensity,7298,Developed,8,8.A,8.A,8.A,Developed-High Intensity,Developed-High Intensity,Developed-High Intensity,8.A,Developed-High Intensity,8.A,Developed-High Intensity,8.A,Developed-High Intensity,173,0,28,0.678431,0,0.109804
7299,Developed-Roads,7299,Developed,8,8.A,8.A,8.A,Developed-Roads,Developed-Roads,Developed-Roads,8.A,Developed-Roads,8.A,Developed-Roads,8.A,Developed-Roads,0,0,0,0,0,0
7300,Developed-Open Space,7300,Developed,8,8.A,8.A,8.A,Developed-Open Space,Developed-Open Space,Developed-Open Space,8.A,Developed-Open Space,8.A,Developed-Open Space,8.A,Developed-Open Space,52,52,52,0.203922,0.203922,0.203922
7735,North American Glacier and Ice Field,7735,Snow-Ice,8,8.E,8.E,8.E,Nonvascular & Sparse Vascular Rock Vegetation,Barren,Barren,8.E,Barren,8.E,Barren,8.E,Barren,159,161,240,0.623529,0.631373,0.941176
7754,Agriculture-Pasture and Hay,7754,Herb,7,7.B,7.B,7.B,7 Agricultural & Developed Vegetation,7.B Herbaceous Agricultural Vegetation,7.B Herbaceous Agricultural Vegetation,7.B Herbaceous Agricultural Vegetation,7.B Herbaceous Agricultural Vegetation,7.B Herbaceous Agricultural Vegetation,Perennial graminoid grassland,7.B Herbaceous Agricultural Vegetation,Agriculture-Pasture and Hay,227,212,28,0.890196,0.831373,0.109804
7755,Agriculture-Cultivated Crops and Irrigated Agriculture,7755,Agriculture,7,7.B,7.B,7.B,7 Agricultural & Developed Vegetation,7.B Herbaceous Agricultural Vegetation,7.B Herbaceous Agricultural Vegetation,7.B Herbaceous Agricultural Vegetation,7.B Herbaceous Agricultural Vegetation,7.B Herbaceous Agricultural Vegetation,Annual Graminoid/Forb,7.B Herbaceous Agricultural Vegetation,Agriculture-Cultivated Crops and Irrigated Agriculture,250,255,119,0.980392,1,0.466667
7834,Tropical Pacific Orchard,7834,Tree,7,7.A,7.A.1,7.A.1.1,7 Agricultural & Developed Vegetation,7.A Woody Agricultural Vegetation,7.A.1 Woody Horticultural Crop,D215,7.A.1.1 Tree Orchard,D215,Tree Orchard,D215,Tropical Pacific Orchard,210,28,94,0.823529,0.109804,0.368627
7835,Tropical Pacific Bush Fruit and Berries,7835,Shrub,7,7.A,7.A.1,7.A.1.3,7 Agricultural & Developed Vegetation,7.A Woody Agricultural Vegetation,7.A.1 Woody Horticultural Crop,D217,7.A.1.3 Bush Fruit & Berry,M559,Bush Fruit & Berry,G738,Tropical & Temperate Bush Fruit & Berry,210,28,119,0.823529,0.109804,0.466667
7836,Tropical Pacific Aquaculture,7836,Agriculture,7,7.D,7.D.1,7.D.1.1,7 Agricultural & Developed Vegetation,7.D Agricultural & Developed Aquatic Vegetation,7.D.1 Agricultural Aquatic Vegetation,D213,7.D.1.1 Agricultural Pond Vegetation,M554,Urban & Recreational Pond Vegetation,G734,Tropical & Temperate Aquaculture,210,255,237,0.823529,1,0.929412
7837,Sugar Cane,7837,Herb,7,7.B,7.B,7.B,7 Agricultural & Developed Vegetation,7.B Herbaceous Agricultural Vegetation,7.B Herbaceous Agricultural Vegetation,7.B Herbaceous Agricultural Vegetation,7.B Herbaceous Agricultural Vegetation,7.B Herbaceous Agricultural Vegetation,Annual Graminoid/Forb,7.B Herbaceous Agricultural Vegetation,Agriculture-Cultivated Crops and Irrigated Agriculture,250,255,119,0.980392,1,0.466667
7838,Caribbean Bush fruit and berries,7838,Shrub,7,7.A,7.A.1,7.A.1.3,7 Agricultural & Developed Vegetation,7.A Woody Agricultural Vegetation,7.A.1 Woody Horticultural Crop,D217,7.A.1.3 Bush Fruit & Berry,M559,Bush Fruit & Berry,G738,Tropical & Temperate Bush Fruit & Berry,210,28,119,0.823529,0.109804,0.466666
7866,Caribbean Emergent Herbaceous Estuary,7866,Herb,5,5.A,5.A,5.A,5 Aquatic Vegetation,5.A Saltwater Aquatic Vegetation,5.A Saltwater Aquatic Vegetation,5.A Saltwater Aquatic Vegetation,5.A Saltwater Aquatic Vegetation,5.A Saltwater Aquatic Vegetation,5.A Saltwater Aquatic Vegetation,5.A Saltwater Aquatic Vegetation,5.A Saltwater Aquatic Vegetation,112,82,57,0.439216,0.321569,0.223529
7900,Western Cool Temperate Urban Deciduous Forest,7900,Tree,7,7.C,7.C.2,7.C.2.1,7 Agricultural & Developed Vegetation,7.C Herbaceous & Woody Developed Vegetation,7.C.2 Other Developed Vegetation,D189,7.C.2.1 Other Developed Vegetation,M550,Tree Developed Vegetation,G729,Temperate Tree Developed Vegetation,112,68,137,0.439216,0.266667,0.537255
7901,Western Cool Temperate Urban Evergreen Forest,7901,Tree,7,7.C,7.C.2,7.C.2.1,7 Agricultural & Developed Vegetation,7.C Herbaceous & Woody Developed Vegetation,7.C.2 Other Developed Vegetation,D189,7.C.2.1 Other Developed Vegetation,M550,Tree Developed Vegetation,G729,Temperate Tree Developed Vegetation,170,102,205,0.666667,0.4,0.803922
7902,Western Cool Temperate Urban Mixed Forest,7902,Tree,7,7.C,7.C.2,7.C.2.1,7 Agricultural & Developed Vegetation,7.C Herbaceous & Woody Developed Vegetation,7.C.2 Other Developed Vegetation,D189,7.C.2.1 Other Developed Vegetation,M550,Tree Developed Vegetation,G729,Temperate Tree Developed Vegetation,194,158,215,0.760784,0.619608,0.843137
7903,Western Cool Temperate Urban Herbaceous,7903,Herb,7,7.C,7.C.2,7.C.2.1,7 Agricultural & Developed Vegetation,7.C Herbaceous & Woody Developed Vegetation,7.C.2 Other Developed Vegetation,D189,7.C.2.1 Other Developed Vegetation,M549,Shrub & Herb Developed Vegetation,G727,Temperate Shrub & Herb Developed Vegetation,202,122,245,0.792157,0.478431,0.960784
7904,Western Cool Temperate Urban Shrubland,7904,Shrub,7,7.C,7.C.2,7.C.2.1,7 Agricultural & Developed Vegetation,7.C Herbaceous & Woody Developed Vegetation,7.C.2 Other Developed Vegetation,D189,7.C.2.1 Other Developed Vegetation,M549,Shrub & Herb Developed Vegetation,G727,Temperate Shrub & Herb Developed Vegetation,207,171,215,0.811765,0.670588,0.843137
7905,Eastern Cool Temperate Urban Deciduous Forest,7905,Tree,7,7.C,7.C.2,7.C.2.1,7 Agricultural & Developed Vegetation,7.C Herbaceous & Woody Developed Vegetation,7.C.2 Other Developed Vegetation,D189,7.C.2.1 Other Developed Vegetation,M550,Tree Developed Vegetation,G729,Temperate Tree Developed Vegetation,112,68,137,0.439216,0.266667,0.537255
7906,Eastern Cool Temperate Urban Evergreen Forest,7906,Tree,7,7.C,7.C.2,7.C.2.1,7 Agricultural & Developed Vegetation,7.C Herbaceous & Woody Developed Vegetation,7.C.2 Other Developed Vegetation,D189,7.C.2.1 Other Developed Vegetation,M550,Tree Developed Vegetation,G729,Temperate Tree Developed Vegetation,170,102,205,0.666667,0.4,0.803922
7907,Eastern Cool Temperate Urban Mixed Forest,7907,Tree,7,7.C,7.C.2,7.C.2.1,7 Agricultural & Developed Vegetation,7.C Herbaceous & Woody Developed Vegetation,7.C.2 Other Developed Vegetation,D189,7.C.2.1 Other Developed Vegetation,M550,Tree Developed Vegetation,G729,Temperate Tree Developed Vegetation,194,158,215,0.760784,0.619608,0.843137
7908,Eastern Cool Temperate Urban Herbaceous,7908,Herb,7,7.C,7.C.2,7.C.2.1,7 Agricultural & Developed Vegetation,7.C Herbaceous & Woody Developed Vegetation,7.C.2 Other Developed Vegetation,D189,7.C.2.1 Other Developed Vegetation,M549,Shrub & Herb Developed Vegetation,G727,Temperate Shrub & Herb Developed Vegetation,202,122,245,0.792157,0.478431,0.960784
7909,Eastern Cool Temperate Urban Shrubland,7909,Shrub,7,7.C,7.C.2,7.C.2.1,7 Agricultural & Developed Vegetation,7.C Herbaceous & Woody Developed Vegetation,7.C.2 Other Developed Vegetation,D189,7.C.2.1 Other Developed Vegetation,M549,Shrub & Herb Developed Vegetation,G727,Temperate Shrub & Herb Developed Vegetation,207,171,215,0.811765,0.670588,0.843137
7910,Western Warm Temperate Urban Deciduous Forest,7910,Tree,7,7.C,7.C.2,7.C.2.1,7 Agricultural & Developed Vegetation,7.C Herbaceous & Woody Developed Vegetation,7.C.2 Other Developed Vegetation,D189,7.C.2.1 Other Developed Vegetation,M550,Tree Developed Vegetation,G729,Temperate Tree Developed Vegetation,112,68,137,0.439216,0.266667,0.537255
7911,Western Warm Temperate Urban Evergreen Forest,7911,Tree,7,7.C,7.C.2,7.C.2.1,7 Agricultural & Developed Vegetation,7.C Herbaceous & Woody Developed Vegetation,7.C.2 Other Developed Vegetation,D189,7.C.2.1 Other Developed Vegetation,M550,Tree Developed Vegetation,G729,Temperate Tree Developed Vegetation,170,102,205,0.666667,0.4,0.803922
7912,Western Warm Temperate Urban Mixed Forest,7912,Tree,7,7.C,7.C.2,7.C.2.1,7 Agricultural & Developed Vegetation,7.C Herbaceous & Woody Developed Vegetation,7.C.2 Other Developed Vegetation,D189,7.C.2.1 Other Developed Vegetation,M550,Tree Developed Vegetation,G729,Temperate Tree Developed Vegetation,194,158,215,0.760784,0.619608,0.843137
7913,Western Warm Temperate Urban Herbaceous,7913,Herb,7,7.C,7.C.2,7.C.2.1,7 Agricultural & Developed Vegetation,7.C Herbaceous & Woody Developed Vegetation,7.C.2 Other Developed Vegetation,D189,7.C.2.1 Other Developed Vegetation,M549,Shrub & Herb Developed Vegetation,G727,Temperate Shrub & Herb Developed Vegetation,202,122,245,0.792157,0.478431,0.960784
7914,Western Warm Temperate Urban Shrubland,7914,Shrub,7,7.C,7.C.2,7.C.2.1,7 Agricultural & Developed Vegetation,7.C Herbaceous & Woody Developed Vegetation,7.C.2 Other Developed Vegetation,D189,7.C.2.1 Other Developed Vegetation,M549,Shrub & Herb Developed Vegetation,G727,Temperate Shrub & Herb Developed Vegetation,207,171,215,0.811765,0.670588,0.843137
7915,Eastern Warm Temperate Urban Deciduous Forest,7915,Tree,7,7.C,7.C.2,7.C.2.1,7 Agricultural & Developed Vegetation,7.C Herbaceous & Woody Developed Vegetation,7.C.2 Other Developed Vegetation,D189,7.C.2.1 Other Developed Vegetation,M550,Tree Developed Vegetation,G729,Temperate Tree Developed Vegetation,112,68,137,0.439216,0.266667,0.537255
7916,Eastern Warm Temperate Urban Evergreen Forest,7916,Tree,7,7.C,7.C.2,7.C.2.1,7 Agricultural & Developed Vegetation,7.C Herbaceous & Woody Developed Vegetation,7.C.2 Other Developed Vegetation,D189,7.C.2.1 Other Developed Vegetation,M550,Tree Developed Vegetation,G729,Temperate Tree Developed Vegetation,170,102,205,0.666667,0.4,0.803922
7917,Eastern Warm Temperate Urban Mixed Forest,7917,Tree,7,7.C,7.C.2,7.C.2.1,7 Agricultural & Developed Vegetation,7.C Herbaceous & Woody Developed Vegetation,7.C.2 Other Developed Vegetation,D189,7.C.2.1 Other Developed Vegetation,M550,Tree Developed Vegetation,G729,Temperate Tree Developed Vegetation,194,158,215,0.760784,0.619608,0.843137
7918,Eastern Warm Temperate Urban Herbaceous,7918,Herb,7,7.C,7.C.2,7.C.2.1,7 Agricultural & Developed Vegetation,7.C Herbaceous & Woody Developed Vegetation,7.C.2 Other Developed Vegetation,D189,7.C.2.1 Other Developed Vegetation,M549,Shrub & Herb Developed Vegetation,G727,Temperate Shrub & Herb Developed Vegetation,202,122,245,0.792157,0.478431,0.960784
7919,Eastern Warm Temperate Urban Shrubland,7919,Shrub,7,7.C,7.C.2,7.C.2.1,7 Agricultural & Developed Vegetation,7.C Herbaceous & Woody Developed Vegetation,7.C.2 Other Developed Vegetation,D189,7.C.2.1 Other Developed Vegetation,M549,Shrub & Herb Developed Vegetation,G727,Temperate Shrub & Herb Developed Vegetation,207,171,215,0.811765,0.670588,0.843137
7920,Western Cool Temperate Developed Ruderal Deciduous Forest,7920,Tree,7,7.C,7.C.2,7.C.2.1,7 Agricultural & Developed Vegetation,7.C Herbaceous & Woody Developed Vegetation,7.C.2 Other Developed Vegetation,D189,7.C.2.1 Other Developed Vegetation,M550,Tree Developed Vegetation,G729,Temperate Tree Developed Vegetation,64,61,168,0.25098,0.239216,0.658824
