VALUE,NVC_NAME,LFRDB,LFLIFEFORM,NVC_CLASS,NVC_SUBCLASS,NVC_FORMATION,NVC_DIVISION,CLASS,SUBCLASS,FORMATION,DIVISION_CODE,DIVISION,MACROGROUP_CODE,MACROGROUP,Group_Code,GROUP,R,G,B,RED,GREEN,BLUE
6065,Central Rocky Mountain Mesic Grand Fir-Douglas-fir Forest,6065,Tree,1,1.B,1.B.2,1.B.2.Nb,1 Forest & Woodland,1.B Temperate & Boreal Forest & Woodland,1.B.2 Cool Temperate Forest & Woodland,D194,1.B.2.Nb Rocky Mountain Cool Temperate Forest,M500,Central Rocky Mountain Mesic Lower Montane Forest,G211,Central Rocky Mountain Mesic Grand Fir-Douglas-fir Forest,96,255,71,0.376471,1,0.278431
6066,Central Rocky Mountain Montane White Spruce Forest,6066,Tree,1,1.B,1.B.2,1.B.2.Nb,1 Forest & Woodland,1.B Temperate & Boreal Forest & Woodland,1.B.2 Cool Temperate Forest & Woodland,D194,1.B.2.Nb Rocky Mountain Cool Temperate Forest,M020,Rocky Mountain Subalpine-High Montane Conifer Forest,G345,Central Rocky Mountain Montane White Spruce Forest,182,250,227,0.713725,0.980392,0.890196
6067,Intermountain Basins Subalpine Limber Pine-Bristlecone Pine Woodland,6067,Tree,1,1.B,1.B.2,1.B.2.Nb,1 Forest & Woodland,1.B Temperate & Boreal Forest & Woodland,1.B.2 Cool Temperate Forest & Woodland,D194,1.B.2.Nb Rocky Mountain Cool Temperate Forest,M020,Rocky Mountain Subalpine-High Montane Conifer Forest,G224,Intermountain Basins Subalpine Limber Pine-Bristlecone Pine Woodland,63,255,46,0.247059,1,0.180392
6068,Northern Rocky Mountain Whitebark Pine-Subalpine Larch Woodland,6068,Tree,1,1.B,1.B.2,1.B.2.Nb,1 Forest & Woodland,1.B Temperate & Boreal Forest & Woodland,1.B.2 Cool Temperate Forest & Woodland,D194,1.B.2.Nb Rocky Mountain Cool Temperate Forest,M020,Rocky Mountain Subalpine-High Montane Conifer Forest,G223,Northern Rocky Mountain Whitebark Pine-Subalpine Larch Woodland,191,255,233,0.74902,1,0.913725
6069,Rocky Mountain Lodgepole Pine Forest & Woodland,6069,Tree,1,1.B,1.B.2,1.B.2.Nb,1 Forest & Woodland,1.B Temperate & Boreal Forest & Woodland,1.B.2 Cool Temperate Forest & Woodland,D194,1.B.2.Nb Rocky Mountain Cool Temperate Forest,M020,Rocky Mountain Subalpine-High Montane Conifer Forest,G220,Rocky Mountain Lodgepole Pine Forest & Woodland,163,240,219,0.639216,0.941176,0.858824
6070,Rocky Mountain Subalpine Dry-Mesic Spruce-Fir Forest & Woodland,6070,Tree,1,1.B,1.B.2,1.B.2.Nb,1 Forest & Woodland,1.B Temperate & Boreal Forest & Woodland,1.B.2 Cool Temperate Forest & Woodland,D194,1.B.2.Nb Rocky Mountain Cool Temperate Forest,M020,Rocky Mountain Subalpine-High Montane Conifer Forest,G219,Rocky Mountain Subalpine Dry-Mesic Spruce-Fir Forest & Woodland,236,252,204,0.92549,0.988235,0.8
6071,Rocky Mountain Subalpine Moist Spruce-Fir Forest & Woodland,6071,Tree,1,1.B,1.B.2,1.B.2.Nb,1 Forest & Woodland,1.B Temperate & Boreal Forest & Woodland,1.B.2 Cool Temperate Forest & Woodland,D194,1.B.2.Nb Rocky Mountain Cool Temperate Forest,M020,Rocky Mountain Subalpine-High Montane Conifer Forest,G218,Rocky Mountain Subalpine Moist Spruce-Fir Forest & Woodland,236,252,204,0.92549,0.988235,0.8
6072,Rocky Mountain Subalpine-Montane Aspen Forest & Woodland,6072,Tree,1,1.B,1.B.2,1.B.2.Nb,1 Forest & Woodland,1.B Temperate & Boreal Forest & Woodland,1.B.2 Cool Temperate Forest & Woodland,D194,1.B.2.Nb Rocky Mountain Cool Temperate Forest,M020,Rocky Mountain Subalpine-High Montane Conifer Forest,G222,Rocky Mountain Subalpine-Montane Aspen Forest & Woodland,192,255,138,0.752941,1,0.541176
6073,Rocky Mountain Subalpine-Montane Limber Pine-Bristlecone Pine Woodland,6073,Tree,1,1.B,1.B.2,1.B.2.Nb,1 Forest & Woodland,1.B Temperate & Boreal Forest & Woodland,1.B.2 Cool Temperate Forest & Woodland,D194,1.B.2.Nb Rocky Mountain Cool Temperate Forest,M020,Rocky Mountain Subalpine-High Montane Conifer Forest,G221,Rocky Mountain Subalpine-Montane Limber Pine-Bristlecone Pine Woodland,63,255,46,0.247059,1,0.180392
6074,Rocky Mountain Douglas-fir-White Fir-Blue Spruce Mesic Forest,6074,Tree,1,1.B,1.B.2,1.B.2.Nb,1 Forest & Woodland,1.B Temperate & Boreal Forest & Woodland,1.B.2 Cool Temperate Forest & Woodland,D194,1.B.2.Nb Rocky Mountain Cool Temperate Forest,M022,Southern Rocky Mountain Lower Montane Forest,G225,Rocky Mountain Douglas-fir-White Fir-Blue Spruce Mesic Forest,0,204,0,0,0.8,0
6075,Southern Rocky Mountain Ponderosa Pine Forest & Woodland,6075,Tree,1,1.B,1.B.2,1.B.2.Nb,1 Forest & Woodland,1.B Temperate & Boreal Forest & Woodland,1.B.2 Cool Temperate Forest & Woodland,D194,1.B.2.Nb Rocky Mountain Cool Temperate Forest,M022,Southern Rocky Mountain Lower Montane Forest,G228,Southern Rocky Mountain Ponderosa Pine Forest & Woodland,214,255,181,0.839216,1,0.709804
6076,Southern Rocky Mountain Ponderosa Pine Savanna,6076,Tree,1,1.B,1.B.2,1.B.2.Nb,1 Forest & Woodland,1.B Temperate & Boreal Forest & Woodland,1.B.2 Cool Temperate Forest & Woodland,D194,1.B.2.Nb Rocky Mountain Cool Temperate Forest,M022,Southern Rocky Mountain Lower Montane Forest,G229,Southern Rocky Mountain Ponderosa Pine Savanna,214,255,181,0.839216,1,0.709804
6077,Southern Rocky Mountain White Fir-Douglas-fir Dry Forest,6077,Tree,1,1.B,1.B.2,1.B.2.Nb,1 Forest & Woodland,1.B Temperate & Boreal Forest & Woodland,1.B.2 Cool Temperate Forest & Woodland,D194,1.B.2.Nb Rocky Mountain Cool Temperate Forest,M022,Southern Rocky Mountain Lower Montane Forest,G226,Southern Rocky Mountain White Fir-Douglas-fir Dry Forest,0,51,0,0,0.2,0
6078,Colorado Plateau-Great Basin Juniper Woodland & Savanna,6078,Tree,1,1.B,1.B.2,1.B.2.Nc,1 Forest & Woodland,1.B Temperate & Boreal Forest & Woodland,1.B.2 Cool Temperate Forest & Woodland,D010,1.B.2.Nc Western North American Cool Temperate Woodland & Scrub,M026,Intermountain Singleleaf Pinyon-Utah Juniper-Western Juniper Woodland,G246,Colorado Plateau-Great Basin Juniper Woodland & Savanna,78,255,59,0.305882,1,0.231373
6079,Colorado Plateau Pinyon-Juniper Woodland,6079,Tree,1,1.B,1.B.2,1.B.2.Nc,1 Forest & Woodland,1.B Temperate & Boreal Forest & Woodland,1.B.2 Cool Temperate Forest & Woodland,D010,1.B.2.Nc Western North American Cool Temperate Woodland & Scrub,M027,Southern Rocky Mountain Two-needle Pinyon-One-seed Juniper Woodland,G250,Colorado Plateau Pinyon-Juniper Woodland,121,255,94,0.47451,1,0.368627
6080,Columbia Plateau Western Juniper Woodland & Savanna,6080,Tree,1,1.B,1.B.2,1.B.2.Nc,1 Forest & Woodland,1.B Temperate & Boreal Forest & Woodland,1.B.2 Cool Temperate Forest & Woodland,D010,1.B.2.Nc Western North American Cool Temperate Woodland & Scrub,M026,Intermountain Singleleaf Pinyon-Utah Juniper-Western Juniper Woodland,G248,Columbia Plateau Western Juniper Woodland & Savanna,108,255,82,0.423529,1,0.321569
6081,Great Basin Pinyon-Juniper Woodland,6081,Tree,1,1.B,1.B.2,1.B.2.Nc,1 Forest & Woodland,1.B Temperate & Boreal Forest & Woodland,1.B.2 Cool Temperate Forest & Woodland,D010,1.B.2.Nc Western North American Cool Temperate Woodland & Scrub,M026,Intermountain Singleleaf Pinyon-Utah Juniper-Western Juniper Woodland,G247,Great Basin Pinyon-Juniper Woodland,78,255,59,0.305882,1,0.231373
6082,Intermountain Basins Curl-leaf Mountain-mahogany Scrub,6082,Shrub,1,1.B,1.B.2,1.B.2.Nc,1 Forest & Woodland,1.B Temperate & Boreal Forest & Woodland,1.B.2 Cool Temperate Forest & Woodland,D010,1.B.2.Nc Western North American Cool Temperate Woodland & Scrub,M026,Intermountain Singleleaf Pinyon-Utah Juniper-Western Juniper Woodland,G249,Intermountain Basins Curl-leaf Mountain-mahogany Scrub & Woodland,155,235,216,0.607843,0.921569,0.847059
6083,Southern Rocky Mountain Juniper Woodland & Savanna,6083,Tree,1,1.B,1.B.2,1.B.2.Nc,1 Forest & Woodland,1.B Temperate & Boreal Forest & Woodland,1.B.2 Cool Temperate Forest & Woodland,D010,1.B.2.Nc Western North American Cool Temperate Woodland & Scrub,M027,Southern Rocky Mountain Two-needle Pinyon-One-seed Juniper Woodland,G252,Southern Rocky Mountain Juniper Woodland & Savanna,121,255,94,0.47451,1,0.368627
6084,Southern Rocky Mountain Pinyon-Juniper Woodland,6084,Tree,1,1.B,1.B.2,1.B.2.Nc,1 Forest & Woodland,1.B Temperate & Boreal Forest & Woodland,1.B.2 Cool Temperate Forest & Woodland,D010,1.B.2.Nc Western North American Cool Temperate Woodland & Scrub,M027,Southern Rocky Mountain Two-needle Pinyon-One-seed Juniper Woodland,G253,Southern Rocky Mountain Pinyon-Juniper Woodland,121,255,94,0.47451,1,0.368627
6085,California Montane Conifer Forest & Woodland,6085,Tree,1,1.B,1.B.2,1.B.2.Nd,1 Forest & Woodland,1.B Temperate & Boreal Forest & Woodland,1.B.2 Cool Temperate Forest & Woodland,D192,1.B.2.Nd Vancouverian Cool Temperate Forest,M023,Southern Vancouverian Montane-Foothill Forest,G344,Californian Montane Conifer Forest & Woodland,0,204,0,0,0.8,0
6086,California Coastal Redwood Forest,6086,Tree,1,1.B,1.B.2,1.B.2.Nd,1 Forest & Woodland,1.B Temperate & Boreal Forest & Woodland,1.B.2 Cool Temperate Forest & Woodland,D192,1.B.2.Nd Vancouverian Cool Temperate Forest,M024,Vancouverian Lowland & Montane Forest,G235,California Coastal Redwood Forest,135,255,105,0.529412,1,0.411765
6087,Cascadian Conifer Forest & Woodland,6087,Tree,1,1.B,1.B.2,1.B.2.Nd,1 Forest & Woodland,1.B Temperate & Boreal Forest & Woodland,1.B.2 Cool Temperate Forest & Woodland,D192,1.B.2.Nd Vancouverian Cool Temperate Forest,M886,Southern Vancouverian Dry Foothill Forest,G206,Cascadian Oregon White Oak-Conifer Forest & Woodland,203,255,171,0.796078,1,0.670588
6088,East Cascades Mesic Grand Fir-Douglas-fir Forest,6088,Tree,1,1.B,1.B.2,1.B.2.Nb,1 Forest & Woodland,1.B Temperate & Boreal Forest & Woodland,1.B.2 Cool Temperate Forest & Woodland,D194,1.B.2.Nb Rocky Mountain Cool Temperate Forest,M500,Central Rocky Mountain Mesic Lower Montane Forest,G212,East Cascades Mesic Grand Fir-Douglas-fir Forest,96,255,71,0.376471,1,0.278431
6089,North Pacific Maritime Douglas-fir-Western Hemlock Forest,6089,Tree,1,1.B,1.B.2,1.B.2.Nd,1 Forest & Woodland,1.B Temperate & Boreal Forest & Woodland,1.B.2 Cool Temperate Forest & Woodland,D192,1.B.2.Nd Vancouverian Cool Temperate Forest,M024,Vancouverian Lowland & Montane Forest,G240,North Pacific Maritime Douglas-fir-Western Hemlock Forest,0,105,0,0,0.411765,0
6090,North Pacific Maritime Silver Fir-Western Hemlock Forest,6090,Tree,1,1.B,1.B.2,1.B.2.Nd,1 Forest & Woodland,1.B Temperate & Boreal Forest & Woodland,1.B.2 Cool Temperate Forest & Woodland,D192,1.B.2.Nd Vancouverian Cool Temperate Forest,M024,Vancouverian Lowland & Montane Forest,G241,North Pacific Maritime Silver Fir-Western Hemlock Forest,0,71,0,0,0.278431,0
6091,North Pacific Red Alder-Bigleaf Maple-Douglas-fir Forest,6091,Tree,1,1.B,1.B.2,1.B.2.Nd,1 Forest & Woodland,1.B Temperate & Boreal Forest & Woodland,1.B.2 Cool Temperate Forest & Woodland,D192,1.B.2.Nd Vancouverian Cool Temperate Forest,M024,Vancouverian Lowland & Montane Forest,G237,North Pacific Red Alder-Bigleaf Maple-Douglas-fir Forest,146,232,215,0.572549,0.909804,0.843137
6092,North Pacific Western Hemlock-Sitka Spruce-Western Red-cedar Seasonal Rainforest,6092,Tree,1,1.B,1.B.2,1.B.2.Nd,1 Forest & Woodland,1.B Temperate & Boreal Forest & Woodland,1.B.2 Cool Temperate Forest & Woodland,D192,1.B.2.Nd Vancouverian Cool Temperate Forest,M024,Vancouverian Lowland & Montane Forest,G751,North Pacific Western Hemlock-Sitka Spruce-Western Red-cedar Seasonal Rainforest,0,82,0,0,0.321569,0
6094,North Pacific Mountain Hemlock-Silver Fir Forest & Tree Island,6094,Tree,1,1.B,1.B.2,1.B.2.Nd,1 Forest & Woodland,1.B Temperate & Boreal Forest & Woodland,1.B.2 Cool Temperate Forest & Woodland,D192,1.B.2.Nd Vancouverian Cool Temperate Forest,M025,Vancouverian Subalpine Forest,G245,North Pacific Mountain Hemlock-Silver Fir Forest & Tree Island,0,92,0,0,0.360784,0
6095,Sierra-Cascade Cold-Dry Subalpine Woodland,6095,Tree,1,1.B,1.B.2,1.B.2.Nd,1 Forest & Woodland,1.B Temperate & Boreal Forest & Woodland,1.B.2 Cool Temperate Forest & Woodland,D192,1.B.2.Nd Vancouverian Cool Temperate Forest,M025,Vancouverian Subalpine Forest,G243,Sierra-Cascade Cold-Dry Subalpine Woodland,163,240,219,0.639216,0.941176,0.858824
6096,Sierra-Cascade Red Fir-Mountain Hemlock Forest,6096,Tree,1,1.B,1.B.2,1.B.2.Nd,1 Forest & Woodland,1.B Temperate & Boreal Forest & Woodland,1.B.2 Cool Temperate Forest & Woodland,D192,1.B.2.Nd Vancouverian Cool Temperate Forest,M025,Vancouverian Subalpine Forest,G749,Sierra-Cascade Red Fir-Mountain Hemlock Forest,0,158,0,0,0.619608,0
6097,Central & Appalachian Seepage Swamp,6097,Tree,1,1.B,1.B.3,1.B.3.Na,1 Forest & Woodland,1.B Temperate & Boreal Forest & Woodland,1.B.3 Temperate Flooded & Swamp Forest,D011,1.B.3.Na Eastern North American & Great Plains Flooded & Swamp Forest,M503,Central & Appalachian Swamp Forest,G044,Central & Appalachian Seepage Swamp,91,195,199,0.356863,0.764706,0.780392
6098,North-Central Flatwoods & Swamp Forest,6098,Tree,1,1.B,1.B.3,1.B.3.Na,1 Forest & Woodland,1.B Temperate & Boreal Forest & Woodland,1.B.3 Temperate Flooded & Swamp Forest,D011,1.B.3.Na Eastern North American & Great Plains Flooded & Swamp Forest,M503,Central & Appalachian Swamp Forest,G597,North-Central Flatwoods & Swamp Forest,91,195,199,0.356863,0.764706,0.780392
6099,South-Central Flatwoods & Pond Forest,6099,Tree,1,1.B,1.B.3,1.B.3.Na,1 Forest & Woodland,1.B Temperate & Boreal Forest & Woodland,1.B.3 Temperate Flooded & Swamp Forest,D011,1.B.3.Na Eastern North American & Great Plains Flooded & Swamp Forest,M503,Central & Appalachian Swamp Forest,G654,South-Central Flatwoods & Pond Forest,145,255,115,0.568627,1,0.45098
6100,Northern & Central Great Plains Floodplain Forest,6100,Tree,1,1.B,1.B.3,1.B.3.Na,1 Forest & Woodland,1.B Temperate & Boreal Forest & Woodland,1.B.3 Temperate Flooded & Swamp Forest,D011,1.B.3.Na Eastern North American & Great Plains Flooded & Swamp Forest,M028,Northern & Central Great Plains Floodplain Forest,G147,Northern & Central Great Plains Floodplain Forest,6,53,122,0.023529,0.207843,0.478431
6101,Silver Maple-Green Ash-Black Ash Floodplain Forest,6101,Tree,1,1.B,1.B.3,1.B.3.Na,1 Forest & Woodland,1.B Temperate & Boreal Forest & Woodland,1.B.3 Temperate Flooded & Swamp Forest,D011,1.B.3.Na Eastern North American & Great Plains Flooded & Swamp Forest,M504,Northern Flooded & Swamp Forest,G653,Silver Maple-Green Ash-Black Ash Floodplain Forest,91,195,199,0.356863,0.764706,0.780392
6102,Silver Maple-Green Ash-Sycamore Floodplain Forest,6102,Tree,1,1.B,1.B.3,1.B.3.Na,1 Forest & Woodland,1.B Temperate & Boreal Forest & Woodland,1.B.3 Temperate Flooded & Swamp Forest,D011,1.B.3.Na Eastern North American & Great Plains Flooded & Swamp Forest,M029,Central & Appalachian Floodplain Forest,G652,Silver Maple-Green Ash-Sycamore Floodplain Forest,0,92,0,0,0.360784,0
6103,Silver Maple-Sugarberry-Sweetgum Floodplain Forest,6103,Tree,1,1.B,1.B.3,1.B.3.Na,1 Forest & Woodland,1.B Temperate & Boreal Forest & Woodland,1.B.3 Temperate Flooded & Swamp Forest,D011,1.B.3.Na Eastern North American & Great Plains Flooded & Swamp Forest,M029,Central & Appalachian Floodplain Forest,G673,Silver Maple-Sugarberry-Sweetgum Floodplain Forest,0,92,0,0,0.360784,0
6104,Northern Atlantic Coastal Hardwood & Conifer Swamp Forest,6104,Tree,1,1.B,1.B.3,1.B.3.Na,1 Forest & Woodland,1.B Temperate & Boreal Forest & Woodland,1.B.3 Temperate Flooded & Swamp Forest,D011,1.B.3.Na Eastern North American & Great Plains Flooded & Swamp Forest,M504,Northern Flooded & Swamp Forest,G039,Northern Atlantic Coastal Hardwood & Conifer Swamp,0,92,0,0,0.360784,0
6105,Laurentian-Acadian-Allegheny Acidic Swamp,6105,Tree,1,1.B,1.B.3,1.B.3.Na,1 Forest & Woodland,1.B Temperate & Boreal Forest & Woodland,1.B.3 Temperate Flooded & Swamp Forest,D011,1.B.3.Na Eastern North American & Great Plains Flooded & Swamp Forest,M504,Northern Flooded & Swamp Forest,G045,Northern Conifer & Hardwood Acidic Swamp,91,195,199,0.356863,0.764706,0.780392
6106,Laurentian-Acadian-Allegheny Alkaline Swamp,6106,Tree,1,1.B,1.B.3,1.B.3.Na,1 Forest & Woodland,1.B Temperate & Boreal Forest & Woodland,1.B.3 Temperate Flooded & Swamp Forest,D011,1.B.3.Na Eastern North American & Great Plains Flooded & Swamp Forest,M504,Northern Flooded & Swamp Forest,G046,Laurentian-Acadian-Allegheny Alkaline Swamp,91,195,199,0.356863,0.764706,0.780392
6108,Pond-cypress Swamp,6108,Tree,1,1.B,1.B.3,1.B.3.Nb,1 Forest & Woodland,1.B Temperate & Boreal Forest & Woodland,1.B.3 Temperate Flooded & Swamp Forest,D062,1.B.3.Nb Southeastern North American Flooded & Swamp Forest,M161,Pond-cypress Basin Swamp,G036,Pond-cypress Basin Swamp,91,195,199,0.356863,0.764706,0.780392
6109,Coastal Plain Hardwood Basin Swamp,6109,Tree,1,1.B,1.B.3,1.B.3.Nb,1 Forest & Woodland,1.B Temperate & Boreal Forest & Woodland,1.B.3 Temperate Flooded & Swamp Forest,D062,1.B.3.Nb Southeastern North American Flooded & Swamp Forest,M033,Southern Coastal Plain Basin Swamp & Flatwoods,G038,Coastal Plain Hardwood Basin Swamp,216,216,191,0.847059,0.847059,0.74902
6110,Hardwood & Loblolly Pine Nonriverine Wet Flatwoods-Evergreen Modifier,6110,Tree,1,1.B,1.B.3,1.B.3.Nb,1 Forest & Woodland,1.B Temperate & Boreal Forest & Woodland,1.B.3 Temperate Flooded & Swamp Forest,D062,1.B.3.Nb Southeastern North American Flooded & Swamp Forest,M033,Southern Coastal Plain Basin Swamp & Flatwoods,G130,Nonriverine Wet Oak Flatwoods,100,204,206,0.392157,0.8,0.807843
6111,Coastal Plain Mixed Evergreen Swamp Forest,6111,Tree,1,1.B,1.B.3,1.B.3.Nb,1 Forest & Woodland,1.B Temperate & Boreal Forest & Woodland,1.B.3 Temperate Flooded & Swamp Forest,D062,1.B.3.Nb Southeastern North American Flooded & Swamp Forest,M032,Southern Coastal Plain Evergreen Hardwood & Conifer Swamp,G037,Coastal Plain Mixed Evergreen Swamp,216,216,191,0.847059,0.847059,0.74902
6112,Bald-cypress-Tupelo Floodplain Forest,6112,Tree,1,1.B,1.B.3,1.B.3.Nb,1 Forest & Woodland,1.B Temperate & Boreal Forest & Woodland,1.B.3 Temperate Flooded & Swamp Forest,D062,1.B.3.Nb Southeastern North American Flooded & Swamp Forest,M031,Southern Coastal Plain Floodplain Forest,G033,Bald-cypress-Tupelo Floodplain Forest,145,255,115,0.568627,1,0.45098
6113,Oak-Sweetgum Floodplain Forest,6113,Tree,1,1.B,1.B.3,1.B.3.Nb,1 Forest & Woodland,1.B Temperate & Boreal Forest & Woodland,1.B.3 Temperate Flooded & Swamp Forest,D062,1.B.3.Nb Southeastern North American Flooded & Swamp Forest,M031,Southern Coastal Plain Floodplain Forest,G034,Oak-Sweetgum Floodplain Forest,145,255,115,0.568627,1,0.45098
6115,Southern Ash-Elm-Willow Floodplain Forest,6115,Tree,1,1.B,1.B.3,1.B.3.Nb,1 Forest & Woodland,1.B Temperate & Boreal Forest & Woodland,1.B.3 Temperate Flooded & Swamp Forest,D062,1.B.3.Nb Southeastern North American Flooded & Swamp Forest,M031,Southern Coastal Plain Floodplain Forest,G759,Southern Ash-Elm-Willow Floodplain Forest,25,160,180,0.098039,0.627451,0.705882
6117,Rocky Mountain & Great Basin Montane Riparian Forest,6117,Tree,1,1.B,1.B.3,1.B.3.Nc,1 Forest & Woodland,1.B Temperate & Boreal Forest & Woodland,1.B.3 Temperate Flooded & Swamp Forest,D195,1.B.3.Nc Rocky Mountain & Great Basin Montane Flooded & Swamp Forest,M034,Rocky Mountain & Great Basin Montane Riparian Forest,G506,Rocky Mountain & Great Basin Montane Riparian Forest,73,171,186,0.286275,0.670588,0.729412
6118,Rocky Mountain & Great Basin Swamp Forest,6118,Tree,1,1.B,1.B.3,1.B.3.Nc,1 Forest & Woodland,1.B Temperate & Boreal Forest & Woodland,1.B.3 Temperate Flooded & Swamp Forest,D195,1.B.3.Nc Rocky Mountain & Great Basin Montane Flooded & Swamp Forest,M034,Rocky Mountain & Great Basin Montane Riparian Forest,G505,Rocky Mountain & Great Basin Swamp Forest,73,171,186,0.286275,0.670588,0.729412
6121,Tamaulipan Wet-Mesic Scrub Forest,6121,Tree,1,1.B,1.B.3,1.B.3.Nd,1 Forest & Woodland,1.B Temperate & Boreal Forest & Woodland,1.B.3 Temperate Flooded & Swamp Forest,D013,1.B.3.Nd Interior Lowland West Flooded & Swamp Forest,M036,Southwest Riparian Forest,G549,Tamaulipan Wet-Mesic Scrub Forest,81,180,141,0.317647,0.705882,0.552941
6122,North Pacific Lowland Riparian Forest & Woodland,6122,Tree,1,1.B,1.B.3,1.B.3.Ng,1 Forest & Woodland,1.B Temperate & Boreal Forest & Woodland,1.B.3 Temperate Flooded & Swamp Forest,D193,1.B.3.Ng Vancouverian Flooded & Swamp Forest,M035,Vancouverian Flooded & Swamp Forest,G254,North Pacific Lowland Riparian Forest & Woodland,67,162,181,0.262745,0.635294,0.709804
6123,North Pacific Maritime Hardwood-Conifer Swamp Forest,6123,Tree,1,1.B,1.B.3,1.B.3.Ng,1 Forest & Woodland,1.B Temperate & Boreal Forest & Woodland,1.B.3 Temperate Flooded & Swamp Forest,D193,1.B.3.Ng Vancouverian Flooded & Swamp Forest,M035,Vancouverian Flooded & Swamp Forest,G256,North Pacific Maritime Hardwood-Conifer Swamp,67,162,181,0.262745,0.635294,0.709804
6124,North Pacific Maritime Poor Fen & Bog Forest & Woodland,6124,Tree,2,2.C,2.C.2,2.C.2.Na,2 Shrub & Herb Vegetation Class,2.C Shrub & Herb Wetland Subclass,2.C.2 Temperate to Polar Bog & Fen Formation,,2.C.2.Na North American Bog & Fen Division,M063,North Pacific Bog & Fen Macrogroup,G610,North Pacific Maritime Wooded Bog & Poor Fen Group,133,39,8,0.521569,0.152941,0.031373
6125,North Pacific Montane Riparian Woodland,6125,Tree,1,1.B,1.B.3,1.B.3.Ng,1 Forest & Woodland,1.B Temperate & Boreal Forest & Woodland,1.B.3 Temperate Flooded & Swamp Forest,D193,1.B.3.Ng Vancouverian Flooded & Swamp Forest,M035,Vancouverian Flooded & Swamp Forest,G507,North Pacific Montane Riparian Woodland,67,162,181,0.262745,0.635294,0.709804
6129,Balsam Fir-Black Spruce Eastern Boreal Rich Swamp,6129,Tree,1,1.B,1.B.5,1.B.5.Na,1 Forest & Woodland,1.B Temperate & Boreal Forest & Woodland,1.B.5 Boreal Flooded & Swamp Forest,D016,1.B.5.Na North American Boreal Flooded & Swamp Forest,M299,"North American Boreal Flooded, Swamp & Bog Forest",G051, Eastern Boreal Balsam Fir-Black Spruce Intermediate-Rich Swamp,186,163,119,0.729412,0.639216,0.466667
6130,Eastern Black Spruce-Tamarack Poor Swamp,6130,Tree,1,1.B,1.B.5,1.B.5.Na,1 Forest & Woodland,1.B Temperate & Boreal Forest & Woodland,1.B.5 Boreal Flooded & Swamp Forest,D016,1.B.5.Na North American Boreal Flooded & Swamp Forest,M299,"North American Boreal Flooded, Swamp & Bog Forest",G050,Eastern Boreal Black Spruce-Tamarack Poor Swamp,186,163,119,0.729412,0.639216,0.466667
6131,Eastern Boreal Hardwood Floodplain & Swamp,6131,Tree,1,1.B,1.B.5,1.B.5.Na,1 Forest & Woodland,1.B Temperate & Boreal Forest & Woodland,1.B.5 Boreal Flooded & Swamp Forest,D016,1.B.5.Na North American Boreal Flooded & Swamp Forest,M299,"North American Boreal Flooded, Swamp & Bog Forest",G052,Eastern Boreal Hardwood Floodplain & Swamp,50,137,168,0.196078,0.537255,0.658824
6132,Caribbean Coastal Cactus Scrub,6132,Shrub,2,2.A,2.A.1,2.A.1.Ea,2 Shrub & Herb Vegetation,"2.A Tropical Grassland, Savanna & Shrubland","2.A.1 Tropical Lowland Grassland, Savanna & Shrubland",D094,"2.A.1.Ea Caribbeo-Mesoamerican Lowland Shrubland, Grassland & Savanna",M671,Caribbean Dry Scrub,G485,Caribbean Coastal Cactus Scrub,145,255,115,0.568627,1,0.45098
6133,Caribbean Coastal Beach & Dune Herb Vegetation,6133,Herb,2,2.A,2.A.3,2.A.3.Ee,2 Shrub & Herb Vegetation,"2.A Tropical Grassland, Savanna & Shrubland",2.A.3 Tropical Scrub & Herb Coastal Vegetation,D254,2.A.3.Ee Caribbeo-Mesoamerican Dine & Coastal Grassland & Shrubland,M700,Caribbean & Mesoamerican Coastal Dune & Beach Vegetation,G127,Caribbean Coastal Beach & Dune Vegetation,100,100,100,0.392157,0.392157,0.392157
6134,Caribbean Coastal Rock Pavement & Cliff,6134,Sparse,2,2.A,2.A.3,2.A.3.Ee,2 Shrub & Herb Vegetation,"2.A Tropical Grassland, Savanna & Shrubland",2.A.3 Tropical Scrub & Herb Coastal Vegetation,D254,2.A.3.Ee Caribbeo-Mesoamerican Dine & Coastal Grassland & Shrubland,M700,Caribbean & Mesoamerican Coastal Dune & Beach Vegetation,G467,Caribbean Coastal Rocky Shore & Cliff,100,100,100,0.392157,0.392157,0.392157
6135,South Florida Freshwater Marsh,6135,Herb,2,2.C,2.C.3,2.C.3.Ef,2 Shrub & Herb Vegetation,2.C Shrub & Herb Wetland,"2.C.3 Tropical Freshwater Marsh, Wet Meadow & Shrubland",D262,"2.C.3.Ef Caribbeo-Mesoamerican Freshwater Marsh, Wet Meadow & Shrubland",M710,"Caribbean Freshwater Marsh, Wet Meadow & Shrubland",G129,South Florida Freshwater Marsh,255,153,0,1,0.6,0
6136,California Maritime Chaparral,6136,Shrub,2,2.B,2.B.1,2.B.1.Na,2 Shrub & Herb Vegetation,2.B Temperate & Boreal Grassland & Shrubland,2.B.1 Mediterranean Scrub & Grassland,D020,2.B.1.Na Californian Scrub,M043,California Chaparral,G258,California Maritime Chaparral,107,77,54,0.419608,0.301961,0.211765
6137,California Mesic & Pre-montane Chaparral,6137,Shrub,2,2.B,2.B.1,2.B.1.Na,2 Shrub & Herb Vegetation,2.B Temperate & Boreal Grassland & Shrubland,2.B.1 Mediterranean Scrub & Grassland,D020,2.B.1.Na Californian Scrub,M043,California Chaparral,G261,California Mesic & Pre-montane Chaparral,59,30,19,0.231373,0.117647,0.07451
6138,California Xeric Chaparral,6138,Shrub,2,2.B,2.B.1,2.B.1.Na,2 Shrub & Herb Vegetation,2.B Temperate & Boreal Grassland & Shrubland,2.B.1 Mediterranean Scrub & Grassland,D020,2.B.1.Na Californian Scrub,M043,California Chaparral,G257,California Xeric Chaparral,99,69,47,0.388235,0.270588,0.184314
6139,California Coastal & Foothill Seral Scrub,6139,Shrub,2,2.B,2.B.1,2.B.1.Na,2 Shrub & Herb Vegetation,2.B Temperate & Boreal Grassland & Shrubland,2.B.1 Mediterranean Scrub & Grassland,D020,2.B.1.Na Californian Scrub,M044,California Coastal Scrub,G782,California Coastal & Foothill Seral Scrub,201,116,30,0.788235,0.454902,0.117647
6140,California North Coastal & Mesic Scrub,6140,Shrub,2,2.B,2.B.1,2.B.1.Na,2 Shrub & Herb Vegetation,2.B Temperate & Boreal Grassland & Shrubland,2.B.1 Mediterranean Scrub & Grassland,D020,2.B.1.Na Californian Scrub,M044,California Coastal Scrub,G662,California North Coastal & Mesic Scrub,201,116,30,0.788235,0.454902,0.117647
6141,Central & Southern California Coastal Sage Scrub,6141,Shrub,2,2.B,2.B.1,2.B.1.Na,2 Shrub & Herb Vegetation,2.B Temperate & Boreal Grassland & Shrubland,2.B.1 Mediterranean Scrub & Grassland,D020,2.B.1.Na Californian Scrub,M044,California Coastal Scrub,G264,Central & Southern California Coastal Sage Scrub,166,139,107,0.65098,0.545098,0.419608
