VALUE,NVC_NAME,LFRDB,LFLIFEFORM,NVC_CLASS,NVC_SUBCLASS,NVC_FORMATION,NVC_DIVISION,CLASS,SUBCLASS,FORMATION,DIVISION_CODE,DIVISION,MACROGROUP_CODE,MACROGROUP,Group_Code,GROUP,R,G,B,RED,GREEN,BLUE
6229,Eastern Saline Wet Meadow & Marsh,6229,Herb,2,2.C,2.C.4,2.C.4.Nd,2 Shrub & Herb Vegetation,2.C Shrub & Herb Wetland,2.C.4 Temperate to Polar Freshwater Marsh Wet Meadow & Shrubland,D323,2.C.4.Nd Eastern North American Wet Meadow Marsh & Shrubland,M069,Eastern North American Wet Meadow & Marsh,G773,Eastern Inland Saline Marsh,255,92,38,1,0.360784,0.14902
6230,Laurentian & Northeast Wet Meadow Herbaceous,6230,Herb,2,2.C,2.C.4,2.C.4.Nd,2 Shrub & Herb Vegetation,2.C Shrub & Herb Wetland,2.C.4 Temperate to Polar Freshwater Marsh Wet Meadow & Shrubland,D323,2.C.4.Nd Eastern North American Wet Meadow Marsh & Shrubland,M069,Eastern North American Wet Meadow & Marsh,G771,Laurentian & Northeast Wet Meadow,255,92,38,1,0.360784,0.14902
6231,Midwest Wet Prairie & Wet Meadow Herbaceous,6231,Herb,2,2.C,2.C.4,2.C.4.Nd,2 Shrub & Herb Vegetation,2.C Shrub & Herb Wetland,2.C.4 Temperate to Polar Freshwater Marsh Wet Meadow & Shrubland,D323,2.C.4.Nd Eastern North American Wet Meadow Marsh & Shrubland,M069,Eastern North American Wet Meadow & Marsh,G770,Midwest Wet Prairie & Wet Meadow,255,92,38,1,0.360784,0.14902
6232,Northern & Central Shrub Swamp,6232,Shrub,2,2.C,2.C.4,2.C.4.Nd,2 Shrub & Herb Vegetation,2.C Shrub & Herb Wetland,2.C.4 Temperate to Polar Freshwater Marsh Wet Meadow & Shrubland,D323,2.C.4.Nd Eastern North American Wet Meadow Marsh & Shrubland,M069,Eastern North American Wet Meadow & Marsh,G167,Northern & Central Shrub Swamp,91,195,199,0.356863,0.764706,0.780392
6233,Northern & Mid-Atlantic Coastal Shrub Wetland,6233,Shrub,2,2.C,2.C.4,2.C.4.Ne,2 Shrub & Herb Vegetation,2.C Shrub & Herb Wetland,2.C.4 Temperate to Polar Freshwater Marsh Wet Meadow & Shrubland,D322,2.C.4.Ne Atlantic & Gulf Coast Freshwater Wet Prairie Marsh & Shrubland,M067,Atlantic & Gulf Coastal Plain Wet Prairie & Marsh,G752,Northern & Mid-Atlantic Coastal Wetland,255,153,0,1,0.6,0
6234,Great Plains Freshwater Marsh,6234,Herb,2,2.C,2.C.4,2.C.4.Nd,2 Shrub & Herb Vegetation,2.C Shrub & Herb Wetland,2.C.4 Temperate to Polar Freshwater Marsh Wet Meadow & Shrubland,D030,2.C.4.Nd Eastern North American Wet Meadow Marsh & Shrubland,M071,Great Plains Wet Meadow Marsh & Playa,G325,Great Plains Freshwater Marsh,255,92,38,1,0.360784,0.14902
6235,Great Plains Playa & Rainwater Basin Wetland,6235,Herb,2,2.C,2.C.4,2.C.4.Nd,2 Shrub & Herb Vegetation,2.C Shrub & Herb Wetland,2.C.4 Temperate to Polar Freshwater Marsh Wet Meadow & Shrubland,D030,2.C.4.Nd Eastern North American Wet Meadow Marsh & Shrubland,M071,Great Plains Wet Meadow Marsh & Playa,G136,Great Plains Playa & Rainwater Basin Wetland,255,137,64,1,0.537255,0.25098
6236,Great Plains Riverine Scour,6236,Shrub,2,2.C,2.C.4,2.C.4.Nd,2 Shrub & Herb Vegetation,2.C Shrub & Herb Wetland,2.C.4 Temperate to Polar Freshwater Marsh Wet Meadow & Shrubland,D323,2.C.4.Nd Eastern North American Wet Meadow Marsh & Shrubland,M071,Great Plains Wet Meadow Marsh & Playa,G568,Great Plains Riverine Scour,145,255,115,0.568627,1,0.45098
6237,Great Plains Shrub Riparian,6237,Shrub,2,2.C,2.C.4,2.C.4.Nd,2 Shrub & Herb Vegetation,2.C Shrub & Herb Wetland,2.C.4 Temperate to Polar Freshwater Marsh Wet Meadow & Shrubland,D323,2.C.4.Nd Eastern North American Wet Meadow Marsh & Shrubland,M071,Great Plains Wet Meadow Marsh & Playa,G337,Great Plains Shrub & Herb Riparian,6,53,122,0.023529,0.207843,0.478431
6238,Great Plains Wet Prairie Wet Meadow & Seepage Fen Grassland,6238,Herb,2,2.C,2.C.4,2.C.4.Nd,2 Shrub & Herb Vegetation,2.C Shrub & Herb Wetland,2.C.4 Temperate to Polar Freshwater Marsh Wet Meadow & Shrubland,D323,2.C.4.Nd Eastern North American Wet Meadow Marsh & Shrubland,M071,Great Plains Wet Meadow Marsh & Playa,G336,Great Plains Wet Prairie Wet Meadow & Seepage Fen ,91,195,199,0.356863,0.764706,0.780392
6239,Western Montane-Subalpine Riparian & Seep Shrubland,6239,Shrub,2,2.C,2.C.4,2.C.4.Nb,2 Shrub & Herb Vegetation,2.C Shrub & Herb Wetland,2.C.4 Temperate to Polar Freshwater Marsh Wet Meadow & Shrubland,D031,2.C.4.Nb Western North American Freshwater Shrubland Wet Meadow & Marsh,M075,Western North American Montane-Subalpine Wet Shrubland & Wet Meadow,G527,Western Montane-Subalpine Riparian & Seep Shrubland,184,96,24,0.721569,0.376471,0.094118
6240,Vancouverian & Rocky Mountain Montane Wet Meadow & Marsh,6240,Herb,2,2.C,2.C.4,2.C.4.Nb,2 Shrub & Herb Vegetation,2.C Shrub & Herb Wetland,2.C.4 Temperate to Polar Freshwater Marsh Wet Meadow & Shrubland,D031,2.C.4.Nb Western North American Freshwater Shrubland Wet Meadow & Marsh,M075,Western North American Montane-Subalpine Wet Shrubland & Wet Meadow,G521,Vancouverian & Rocky Mountain Montane Wet Meadow & Marsh,4,45,117,0.015686,0.176471,0.458824
6241,Vancouverian & Rocky Mountain Subalpine & Alpine Snowbed Wet Meadow,6241,Herb,2,2.C,2.C.4,2.C.4.Nb,2 Shrub & Herb Vegetation,2.C Shrub & Herb Wetland,2.C.4 Temperate to Polar Freshwater Marsh Wet Meadow & Shrubland,D031,2.C.4.Nb Western North American Freshwater Shrubland Wet Meadow & Marsh,M075,Western North American Montane-Subalpine Wet Shrubland & Wet Meadow,G520,Vancouverian & Rocky Mountain Subalpine & Alpine Snowbed Wet Meadow & Dwarf-Shrubland,4,45,117,0.015686,0.176471,0.458824
6242,Arid West Interior Freshwater Emergent Marsh,6242,Herb,2,2.C,2.C.4,2.C.4.Nb,2 Shrub & Herb Vegetation,2.C Shrub & Herb Wetland,2.C.4 Temperate to Polar Freshwater Marsh Wet Meadow & Shrubland,D031,2.C.4.Nb Western North American Freshwater Shrubland Wet Meadow & Marsh,M888,Arid West Interior Freshwater Emergent Marsh,G531,Arid West Interior Freshwater Emergent Marsh,100,100,100,0.392157,0.392157,0.392157
6243,Rocky Mountain & Great Basin Lowland & Foothill Riparian Shrubland,6243,Shrub,2,2.C,2.C.4,2.C.4.Nb,2 Shrub & Herb Vegetation,2.C Shrub & Herb Wetland,2.C.4 Temperate to Polar Freshwater Marsh Wet Meadow & Shrubland,D031,2.C.4.Nb Western North American Freshwater Shrubland Wet Meadow & Marsh,M075,Western North American Montane-Subalpine Wet Shrubland & Wet Meadow,G526,Rocky Mountain & Great Basin Lowland & Foothill Riparian Shrubland,73,171,186,0.286275,0.670588,0.729412
6245,Vancouverian Freshwater Wet Meadow & Marsh,6245,Herb,2,2.C,2.C.4,2.C.4.Nb,2 Shrub & Herb Vegetation,2.C Shrub & Herb Wetland,2.C.4 Temperate to Polar Freshwater Marsh Wet Meadow & Shrubland,D031,2.C.4.Nb Western North American Freshwater Shrubland Wet Meadow & Marsh,M073,Vancouverian Lowland Wet Shrubland Wet Meadow & Marsh,G517,Vancouverian Freshwater Wet Meadow & Marsh,255,153,0,1,0.6,0
6246,Vancouverian Wet Shrubland,6246,Shrub,2,2.C,2.C.4,2.C.4.Nb,2 Shrub & Herb Vegetation,2.C Shrub & Herb Wetland,2.C.4 Temperate to Polar Freshwater Marsh Wet Meadow & Shrubland,D031,2.C.4.Nb Western North American Freshwater Shrubland Wet Meadow & Marsh,M073,Vancouverian Lowland Wet Shrubland Wet Meadow & Marsh,G322,Vancouverian Wet Shrubland,146,237,224,0.572549,0.929412,0.878431
6249,North American Warm Desert Riparian Low Bosque & Shrubland,6249,Shrub,2,2.C,2.C.4,2.C.4.Nc,2 Shrub & Herb Vegetation,2.C Shrub & Herb Wetland,2.C.4 Temperate to Polar Freshwater Marsh Wet Meadow & Shrubland,D032,2.C.4.Nc Southwestern North American Warm Desert Freshwater Bosque & Marsh,M076,Warm Desert Lowland Freshwater Shrubland meadow & Marsh,G533,North American Warm Desert Riparian Low Bosque & Shrubland,81,180,141,0.317647,0.705882,0.552941
6251,Great Plains Depressional Saline & Brackish Wetland ,6251,Herb,2,2.C,2.C.5,2.C.5.Na,2 Shrub & Herb Vegetation,2.C Shrub & Herb Wetland,2.C.5 Salt Marsh,D033,2.C.5.Na North American Great Plains Brackish Marsh,M077,Great Plains Brackish Marsh & Saline Wet Meadow,G324,Great Plains Depressional Saline & Brackish Wetland,255,137,64,1,0.537255,0.25098
6252,Western Great Plains Saline Depression Wetland,6252,Herb,2,2.C,2.C.5,2.C.5.Na,2 Shrub & Herb Vegetation,2.C Shrub & Herb Wetland,2.C.5 Salt Marsh,D033,2.C.5.Na North American Great Plains Brackish Marsh,M077,Great Plains Brackish Marsh & Saline Wet Meadow,G534,Western Great Plains Saline Depression Wetland,255,137,64,1,0.537255,0.25098
6253,Atlantic & Gulf Coast Brackish Tidal Marsh,6253,Herb,2,2.C,2.C.5,2.C.5.Nb,2 Shrub & Herb Vegetation,2.C Shrub & Herb Wetland,2.C.5 Salt Marsh,D034,2.C.5.Nb Temperate & Boreal Atlantic Coastal Salt Marsh,M079,North American Atlantic & Gulf Coast Salt Marsh ,G120,Atlantic & Gulf Coast Brackish Tidal Marsh,255,153,0,1,0.6,0
6254,Atlantic & Gulf Coast High Salt Marsh,6254,Herb,2,2.C,2.C.5,2.C.5.Nb,2 Shrub & Herb Vegetation,2.C Shrub & Herb Wetland,2.C.5 Salt Marsh,D034,2.C.5.Nb Temperate & Boreal Atlantic Coastal Salt Marsh,M079,North American Atlantic & Gulf Coast Salt Marsh ,G121,Atlantic & Gulf Coast High Salt Marsh,255,153,0,1,0.6,0
6255,Atlantic & Gulf Coast Low Salt Marsh,6255,Herb,2,2.C,2.C.5,2.C.5.Nb,2 Shrub & Herb Vegetation,2.C Shrub & Herb Wetland,2.C.5 Salt Marsh,D034,2.C.5.Nb Temperate & Boreal Atlantic Coastal Salt Marsh,M079,North American Atlantic & Gulf Coast Salt Marsh ,G122,Atlantic & Gulf Coast Low Salt Marsh,255,153,0,1,0.6,0
6256,Atlantic & Gulf Coast Saline Flat & Panne,6256,Herb,2,2.C,2.C.5,2.C.5.Nb,2 Shrub & Herb Vegetation,2.C Shrub & Herb Wetland,2.C.5 Salt Marsh,D034,2.C.5.Nb Temperate & Boreal Atlantic Coastal Salt Marsh,M079,North American Atlantic & Gulf Coast Salt Marsh ,G123,Atlantic & Gulf Coast Saline Flat & Panne,255,153,0,1,0.6,0
6257,Temperate Pacific Tidal Salt & Brackish Marsh,6257,Herb,2,2.C,2.C.5,2.C.5.Nc,2 Shrub & Herb Vegetation,2.C Shrub & Herb Wetland,2.C.5 Salt Marsh,D035,2.C.5.Nc Temperate & Boreal Pacific Coastal Salt Marsh,M081,North American Pacific Coastal Salt Marsh,G499,Temperate Pacific Tidal Salt & Brackish Marsh,255,153,10,1,0.6,0.039216
6258,North American Desert Alkaline-Saline Shrub Wetland,6258,Shrub,2,2.C,2.C.5,2.C.5.Nd,2 Shrub & Herb Vegetation,2.C Shrub & Herb Wetland,2.C.5 Salt Marsh,D036,2.C.5.Nd North American Western Interior Brackish Marsh,M082,Warm & Cool Desert Alkali-Saline Wetland,G537,North American Desert Alkaline-Saline Shrub Wetland,100,100,100,0.392157,0.392157,0.392157
6259,North American Desert Alkaline-Saline Herbaceous Wetland,6259,Herb,2,2.C,2.C.5,2.C.5.Nd,2 Shrub & Herb Vegetation,2.C Shrub & Herb Wetland,2.C.5 Salt Marsh,D036,2.C.5.Nd North American Western Interior Brackish Marsh,M082,Warm & Cool Desert Alkali-Saline Wetland,G538,North American Desert Alkaline-Saline Herbaceous Wetland & Playa,100,100,100,0.392157,0.392157,0.392157
6260,Caribbean Salt Flat & Pond,6260,Sparse,2,2.C,2.C.5,2.C.5.Ue,2 Shrub & Herb Vegetation,2.C Shrub & Herb Wetland,2.C.5 Salt Marsh,D037,2.C.5.Ue Tropical Atlantic Coastal Marsh,M735,Tropical Western Atlantic & Caribbean Salt Marsh,G486,Caribbean Salt Flat & Pond,100,100,100,0.392157,0.392157,0.392157
6261,Chihuahuan Creosotebush-Mixed Desert Scrub,6261,Shrub,3,3.A,3.A.2,3.A.2.Na,3 Desert & Semi-Desert,3.A Warm Desert & Semi-Desert Woodland,3.A.2 Warm Desert & Semi-Desert Scrub & Grassland,D039,3.A.2.Na North American Warm Desert Scrub & Grassland,M086,Chihuahuan Desert Scrub,G288,Chihuahuan Creosotebush-Mixed Desert Scrub,74,44,29,0.290196,0.172549,0.113725
6262,Chihuahuan Desert Lowland Basin Scrub,6262,Shrub,3,3.A,3.A.2,3.A.2.Na,3 Desert & Semi-Desert,3.A Warm Desert & Semi-Desert Woodland,3.A.2 Warm Desert & Semi-Desert Scrub & Grassland,D039,3.A.2.Na North American Warm Desert Scrub & Grassland,M086,Chihuahuan Desert Scrub,G299,Chihuahuan Desert Lowland Basin Scrub,156,128,92,0.611765,0.501961,0.360784
6263,Chihuahuan Desert Sand Scrub,6263,Shrub,3,3.A,3.A.2,3.A.2.Na,3 Desert & Semi-Desert,3.A Warm Desert & Semi-Desert Woodland,3.A.2 Warm Desert & Semi-Desert Scrub & Grassland,D039,3.A.2.Na North American Warm Desert Scrub & Grassland,M086,Chihuahuan Desert Scrub,G287,Chihuahuan Desert Sand Scrub,150,123,89,0.588235,0.482353,0.34902
6264,Chihuahuan Desert Succulent Scrub,6264,Shrub,3,3.A,3.A.2,3.A.2.Na,3 Desert & Semi-Desert,3.A Warm Desert & Semi-Desert Woodland,3.A.2 Warm Desert & Semi-Desert Scrub & Grassland,D039,3.A.2.Na North American Warm Desert Scrub & Grassland,M086,Chihuahuan Desert Scrub,G286,Chihuahuan Desert Succulent Scrub,145,117,84,0.568627,0.458824,0.329412
6266,Chihuahuan Desert Foothill-Piedmont & Lower Montane Grassland,6266,Herb,3,3.A,3.A.2,3.A.2.Na,3 Desert & Semi-Desert,3.A Warm Desert & Semi-Desert Woodland,3.A.2 Warm Desert & Semi-Desert Scrub & Grassland,D039,3.A.2.Na North American Warm Desert Scrub & Grassland,M087,Chihuahuan Semi-Desert Grassland,G490,Chihuahuan Desert Foothill-Piedmont & Lower Montane Grassland,255,204,51,1,0.8,0.2
6267,Chihuahuan Gypsophilous Grassland,6267,Herb,3,3.A,3.A.2,3.A.2.Na,3 Desert & Semi-Desert,3.A Warm Desert & Semi-Desert Woodland,3.A.2 Warm Desert & Semi-Desert Scrub & Grassland,D039,3.A.2.Na North American Warm Desert Scrub & Grassland,M087,Chihuahuan Semi-Desert Grassland,G492,Chihuahuan Gypsophilous Grassland,255,204,51,1,0.8,0.2
6268,Chihuahuan Sandy Plains Semi-Desert Grassland,6268,Herb,3,3.A,3.A.2,3.A.2.Na,3 Desert & Semi-Desert,3.A Warm Desert & Semi-Desert Woodland,3.A.2 Warm Desert & Semi-Desert Scrub & Grassland,D039,3.A.2.Na North American Warm Desert Scrub & Grassland,M087,Chihuahuan Semi-Desert Grassland,G491,Chihuahuan Sandy Plains Semi-Desert Grassland,255,233,135,1,0.913725,0.529412
6269,Chihuahuan Semi-Desert Lowland Grassland,6269,Herb,3,3.A,3.A.2,3.A.2.Na,3 Desert & Semi-Desert,3.A Warm Desert & Semi-Desert Woodland,3.A.2 Warm Desert & Semi-Desert Scrub & Grassland,D039,3.A.2.Na North American Warm Desert Scrub & Grassland,M087,Chihuahuan Semi-Desert Grassland,G489,Chihuahuan Semi-Desert Lowland Grassland,255,204,51,1,0.8,0.2
6270,Baja Semi-Desert Coastal Succulent Scrub,6270,Shrub,3,3.A,3.A.2,3.A.2.Na,3 Desert & Semi-Desert,3.A Warm Desert & Semi-Desert Woodland,3.A.2 Warm Desert & Semi-Desert Scrub & Grassland,D039,3.A.2.Na North American Warm Desert Scrub & Grassland,M088,Mojave-Sonoran Semi-Desert Scrub,G298,Baja Semi-Desert Coastal Succulent Scrub,166,139,107,0.65098,0.545098,0.419608
6271,Mojave Mid-Elevation Mixed Desert Scrub,6271,Shrub,3,3.A,3.A.2,3.B.1.Ne,3 Desert & Semi-Desert,3.B Cool Semi-Desert Scrub & Grassland,3.B.1 Cool Semi-Desert Scrub & Grassland,D040,3.B.1.Ne Western North American Cool Semi-Desert Scrub & Grassland,M171,Great Basin & Intermountain Dry Shrubland & Grassland,G296,Mojave Mid-Elevation Mixed Desert Scrub,140,112,80,0.54902,0.439216,0.313725
6272,Mojave-Sonoran Bajada & Valley Desert Scrub,6272,Shrub,3,3.A,3.A.2,3.A.2.Na,3 Desert & Semi-Desert,3.A Warm Desert & Semi-Desert Woodland,3.A.2 Warm Desert & Semi-Desert Scrub & Grassland,D039,3.A.2.Na North American Warm Desert Scrub & Grassland,M088,Mojave-Sonoran Semi-Desert Scrub,G295,Mojave-Sonoran Bajada & Valley Desert Scrub,161,134,96,0.631373,0.52549,0.376471
6273,North American Warm Semi-Desert Herb Dunes & Sand Flats,6273,Herb,3,3.A,3.A.2,3.A.2.Na,3 Desert & Semi-Desert,3.A Warm Desert & Semi-Desert Woodland,3.A.2 Warm Desert & Semi-Desert Scrub & Grassland,D039,3.A.2.Na North American Warm Desert Scrub & Grassland,M088,Mojave-Sonoran Semi-Desert Scrub,G675,North American Warm Semi-Desert Dunes & Sand Flats,100,100,100,0.392157,0.392157,0.392157
6274,Sonoran Paloverde-Mixed Cacti Desert Scrub,6274,Shrub,3,3.A,3.A.2,3.A.2.Na,3 Desert & Semi-Desert,3.A Warm Desert & Semi-Desert Woodland,3.A.2 Warm Desert & Semi-Desert Scrub & Grassland,D039,3.A.2.Na North American Warm Desert Scrub & Grassland,M088,Mojave-Sonoran Semi-Desert Scrub,G293,Sonoran Paloverde-Mixed Cacti Desert Scrub,242,168,48,0.94902,0.658824,0.188235
6276,Warm Semi-Desert Shrub Dry Wash & Colluvial Slope,6276,Shrub,3,3.A,3.A.2,3.A.2.Na,3 Desert & Semi-Desert,3.A Warm Desert & Semi-Desert Woodland,3.A.2 Warm Desert & Semi-Desert Scrub & Grassland,D039,3.A.2.Na North American Warm Desert Scrub & Grassland,M092,North American Warm-Desert Xeric-Riparian Scrub,G541,Warm Semi-Desert Shrub & Herb Dry Wash & Colluvial Slope,81,180,141,0.317647,0.705882,0.552941
6277,Tamaulipan Dry Grassland,6277,Herb,3,3.A,3.A.2,3.A.2.Na,3 Desert & Semi-Desert,3.A Warm Desert & Semi-Desert Woodland,3.A.2 Warm Desert & Semi-Desert Scrub & Grassland,D039,3.A.2.Na North American Warm Desert Scrub & Grassland,M130,Tamaulipan Scrub & Grassland,G100,Tamaulipan Dry Grassland,82,52,34,0.321569,0.203922,0.133333
6278,Tamaulipan Dry Mesquite & Thornscrub Shrubland,6278,Shrub,3,3.A,3.A.2,3.A.2.Na,3 Desert & Semi-Desert,3.A Warm Desert & Semi-Desert Woodland,3.A.2 Warm Desert & Semi-Desert Scrub & Grassland,D039,3.A.2.Na North American Warm Desert Scrub & Grassland,M130,Tamaulipan Scrub & Grassland,G099,Tamaulipan Dry Mesquite & Thornscrub,82,52,34,0.321569,0.203922,0.133333
6279,Colorado Plateau Blackbrush-Mormon-tea Shrubland,6279,Shrub,3,3.B,3.B.1,3.B.1.Ne,3 Desert & Semi-Desert,3.B Cool Semi-Desert Scrub & Grassland,3.B.1 Cool Semi-Desert Scrub & Grassland,D040,3.B.1.Ne Western North American Cool Semi-Desert Scrub & Grassland,M171,Great Basin & Intermountain Dry Shrubland & Grassland,G312,Colorado Plateau Blackbrush-Mormon-tea Shrubland,140,112,80,0.54902,0.439216,0.313725
6281,Intermountain Semi-Desert Grassland,6281,Herb,3,3.B,3.B.1,3.B.1.Ne,3 Desert & Semi-Desert,3.B Cool Semi-Desert Scrub & Grassland,3.B.1 Cool Semi-Desert Scrub & Grassland,D040,3.B.1.Ne Western North American Cool Semi-Desert Scrub & Grassland,M171,Great Basin & Intermountain Dry Shrubland & Grassland,G311,Intermountain Semi-Desert Grassland,255,226,130,1,0.886275,0.509804
6282,Intermountain Semi-Desert Shrubland & Steppe,6282,Shrub,3,3.B,3.B.1,3.B.1.Ne,3 Desert & Semi-Desert,3.B Cool Semi-Desert Scrub & Grassland,3.B.1 Cool Semi-Desert Scrub & Grassland,D040,3.B.1.Ne Western North American Cool Semi-Desert Scrub & Grassland,M171,Great Basin & Intermountain Dry Shrubland & Grassland,G310,Intermountain Semi-Desert Shrubland & Steppe,130,101,72,0.509804,0.396078,0.282353
6283,Intermountain Dune Scrub,6283,Shrub,3,3.B,3.B.1,3.B.1.Ne,3 Desert & Semi-Desert,3.B Cool Semi-Desert Scrub & Grassland,3.B.1 Cool Semi-Desert Scrub & Grassland,D040,3.B.1.Ne Western North American Cool Semi-Desert Scrub & Grassland,M171,Great Basin & Intermountain Dry Shrubland & Grassland,G775,Intermountain Sparsely Vegetated Dune Scrub & Grassland,100,100,100,0.392157,0.392157,0.392157
6284,Columbia Plateau Scabland Shrubland,6284,Shrub,3,3.B,3.B.1,3.B.1.Ne,3 Desert & Semi-Desert,3.B Cool Semi-Desert Scrub & Grassland,3.B.1 Cool Semi-Desert Scrub & Grassland,D040,3.B.1.Ne Western North American Cool Semi-Desert Scrub & Grassland,M170,Great Basin & Intermountain Dwarf Sagebrush Shrubland & Steppe,G307,Columbia Plateau Scabland Shrubland,199,176,129,0.780392,0.690196,0.505882
6285,Intermountain Low & Black Sagebrush Shrubland & Steppe,6285,Shrub,3,3.B,3.B.1,3.B.1.Ne,3 Desert & Semi-Desert,3.B Cool Semi-Desert Scrub & Grassland,3.B.1 Cool Semi-Desert Scrub & Grassland,D040,3.B.1.Ne Western North American Cool Semi-Desert Scrub & Grassland,M170,Great Basin & Intermountain Dwarf Sagebrush Shrubland & Steppe,G308,Intermountain Low & Black Sagebrush Shrubland & Steppe,204,182,135,0.8,0.713725,0.529412
6286,Intermountain Dry Tall Sagebrush Shrubland,6286,Shrub,3,3.B,3.B.1,3.B.1.Ne,3 Desert & Semi-Desert,3.B Cool Semi-Desert Scrub & Grassland,3.B.1 Cool Semi-Desert Scrub & Grassland,D040,3.B.1.Ne Western North American Cool Semi-Desert Scrub & Grassland,M169,Great Basin & Intermountain Tall Sagebrush Shrubland & Steppe,G303,Intermountain Dry Tall Sagebrush Shrubland,135,106,76,0.529412,0.415686,0.298039
6287,Intermountain Mesic Tall Sagebrush Shrubland & Steppe,6287,Shrub,3,3.B,3.B.1,3.B.1.Ne,3 Desert & Semi-Desert,3.B Cool Semi-Desert Scrub & Grassland,3.B.1 Cool Semi-Desert Scrub & Grassland,D040,3.B.1.Ne Western North American Cool Semi-Desert Scrub & Grassland,M169,Great Basin & Intermountain Tall Sagebrush Shrubland & Steppe,G302,Intermountain Mesic Tall Sagebrush Shrubland & Steppe,199,176,129,0.780392,0.690196,0.505882
6288,Intermountain Mountain Big Sagebrush Shrubland & Steppe,6288,Shrub,3,3.B,3.B.1,3.B.1.Ne,3 Desert & Semi-Desert,3.B Cool Semi-Desert Scrub & Grassland,3.B.1 Cool Semi-Desert Scrub & Grassland,D040,3.B.1.Ne Western North American Cool Semi-Desert Scrub & Grassland,M169,Great Basin & Intermountain Tall Sagebrush Shrubland & Steppe,G304,Intermountain Mountain Big Sagebrush Shrubland & Steppe,219,140,37,0.858824,0.54902,0.145098
6289,Cool Semi-Desert Shrub & Herb Wash-Arroyo,6289,Shrub,3,3.B,3.B.1,3.B.1.Ne,3 Desert & Semi-Desert,3.B Cool Semi-Desert Scrub & Grassland,3.B.1 Cool Semi-Desert Scrub & Grassland,D040,3.B.1.Ne Western North American Cool Semi-Desert Scrub & Grassland,M095,Great Basin & Intermountain Xeric-Riparian Scrub,G559,Cool Semi-Desert Shrub & Herb Wash-Arroyo,100,100,100,0.392157,0.392157,0.392157
6290,Intermountain Dwarf Saltbush-Sagebrush Scrub,6290,Shrub,3,3.B,3.B.1,3.B.1.Ne,3 Desert & Semi-Desert,3.B Cool Semi-Desert Scrub & Grassland,3.B.1 Cool Semi-Desert Scrub & Grassland,D040,3.B.1.Ne Western North American Cool Semi-Desert Scrub & Grassland,M093,Great Basin Saltbush Scrub,G301,Intermountain Dwarf Saltbush-Sagebrush Scrub,194,170,126,0.760784,0.666667,0.494118
6291,Intermountain Shadscale-Saltbush Scrub,6291,Shrub,3,3.B,3.B.1,3.B.1.Ne,3 Desert & Semi-Desert,3.B Cool Semi-Desert Scrub & Grassland,3.B.1 Cool Semi-Desert Scrub & Grassland,D040,3.B.1.Ne Western North American Cool Semi-Desert Scrub & Grassland,M093,Great Basin Saltbush Scrub,G300,Intermountain Shadscale-Saltbush Scrub,156,128,92,0.611765,0.501961,0.360784
6292,Eastern Alpine Dwarf-Shrub Vegetation,6292,Shrub,4,4.B,4.B.1,4.B.1.Na,4 Polar & High Montane Scrub Grassland & Barrens,4.B Temperate to Polar Alpine & Tundra Vegetation,4.B.1 Temperate & Boreal Alpine Dwarf-Shrub & Grassland,D042,4.B.1.Na Eastern North American Alpine Dwarf-Shrub & Grassland,M131,Eastern North American Alpine Shrub & Grassland,G104,Eastern Alpine Dwarf-Shrub-Herb Vegetation,181,156,114,0.709804,0.611765,0.447059
6293,Rocky Mountain & Sierran Alpine Dwarf-Shrubland,6293,Shrub,4,4.B,4.B.1,4.B.1.Nb,4 Polar & High Montane Scrub Grassland & Barrens,4.B Temperate to Polar Alpine & Tundra Vegetation,4.B.1 Temperate & Boreal Alpine Dwarf-Shrub & Grassland,D043,4.B.1.Nb Western North American Alpine Dwarf-Shrub & Grassland,M099,Rocky Mountain & Sierran Alpine Scrub Forb Meadow & Grassland,G316,Rocky Mountain & Sierran Alpine Dwarf-shrubland,171,145,106,0.670588,0.568627,0.415686
6294,Rocky Mountain & Sierran Alpine Turf & Fell-Field,6294,Herb,4,4.B,4.B.1,4.B.1.Nb,4 Polar & High Montane Scrub Grassland & Barrens,4.B Temperate to Polar Alpine & Tundra Vegetation,4.B.1 Temperate & Boreal Alpine Dwarf-Shrub & Grassland,D043,4.B.1.Nb Western North American Alpine Dwarf-Shrub & Grassland,M099,Rocky Mountain & Sierran Alpine Scrub Forb Meadow & Grassland,G314,Rocky Mountain & Sierran Alpine Turf & Fell-Field,255,211,119,1,0.827451,0.466667
6295,North Pacific Alpine-Subalpine Dwarf-Shrubland & Heath,6295,Shrub,4,4.B,4.B.1,4.B.1.Nb,4 Polar & High Montane Scrub Grassland & Barrens,4.B Temperate to Polar Alpine & Tundra Vegetation,4.B.1 Temperate & Boreal Alpine Dwarf-Shrub & Grassland,D043,4.B.1.Nb Western North American Alpine Dwarf-Shrub & Grassland,M101,Vancouverian Alpine Scrub Forb Meadow & Grassland,G317,North Pacific Alpine-Subalpine Dwarf-Shrubland & Heath,181,156,114,0.709804,0.611765,0.447059
6296,North Pacific Alpine-Subalpine Turf & Herbaceous Meadow,6296,Herb,4,4.B,4.B.1,4.B.1.Nb,4 Polar & High Montane Scrub Grassland & Barrens,4.B Temperate to Polar Alpine & Tundra Vegetation,4.B.1 Temperate & Boreal Alpine Dwarf-Shrub & Grassland,D043,4.B.1.Nb Western North American Alpine Dwarf-Shrub & Grassland,M101,Vancouverian Alpine Scrub Forb Meadow & Grassland,G320,North Pacific Alpine-Subalpine Turf & Herbaceous Meadow,255,211,119,1,0.827451,0.466667
6298,North American North Atlantic Intertidal Shore,6298,Herb,5,5.A,5.A.2,5.A.2.Wb,5 Aquatic Vegetation,5.A Saltwater Aquatic Vegetation,5.A.2 Benthic Macroalgae Saltwater Vegetation,D047,5.A.2.Wb 5.A.2.Wb Temperate Intertidal Shore,M104,Temperate Atlantic Intertidal Shore,G387,North American North Atlantic Intertidal Shore,255,153,0,1,0.6,0
6300,North Atlantic Seagrass,6300,Herb,5,5.A,5.A.3,5.A.3.We,5 Aquatic Vegetation,5.A Saltwater Aquatic Vegetation,5.A.3 Benthic Vascular Saltwater Vegetation,D064,5.A.3.We Temperate Seagrass Aquatic Vegetation,M183,Temperate Eel-grass Vegetation,G380,North Atlantic Seagrass,255,153,0,1,0.6,0
6305,Eastern North American Freshwater Aquatic Vegetation,6305,Herb,5,5.B,5.B.2,5.B.2.Na,5 Aquatic Vegetation,5.B Freshwater Aquatic vegetation,5.B.2 Temperate & Boreal Freshwater Aquatic vegetation,D049,5.B.2.Na North American Freshwater Aquatic Vegetation,M108,Eastern North American Freshwater Aquatic Vegetation,G114,Eastern North American Freshwater Aquatic Vegetation,255,137,64,1,0.537255,0.25098
6308,California Cliff Scree & Rock Vegetation,6308,Sparse,6,6.B,6.B.1,6.B.1.Nh,6 Open Rock Vegetation,6.B Temperate & Boreal Open Rock Vegetation,6.B.1 Temperate & Boreal Cliff Scree & Other Rock Vegetation,D052,6.B.1.Nb Western North American Temperate Cliff Scree & Rock Vegetation,M887,Western North American Temperate Cliff Scree & Rock Vegetation,G563,California Cliff Scree & Rock Vegetation,100,100,100,0.392157,0.392157,0.392157
6309,Eastern North American Talus & Bluff,6309,Sparse,6,6.B,6.B.1,6.B.1.Na,6 Open Rock Vegetation,6.B Temperate & Boreal Open Rock Vegetation,6.B.1 Temperate & Boreal Cliff Scree & Other Rock Vegetation,D051,6.B.1.Na Eastern North American Temperate Cliff Scree & Rock Vegetation,M111,Eastern North American Cliff & Rock Vegetation,G340,Eastern North American Talus & Bluff,100,100,100,0.392157,0.392157,0.392157
